[
  {
    "id": "5981b41dc53210fc075daac3",
    "title": "Reminder: Connor Pham's Bday",
    "body": "Due in 31 days (6/26/2025)",
    "scheduledTime": "2025-06-26T14:00:00.000Z",
    "repeat": "none",
    "createdAt": 1748316012636,
    "data": {}
  },
  {
    "id": "edae89506f8de80750285a50",
    "title": "Reminder: Alvin Matthew's Bday",
    "body": "Due in 31 days (6/26/2025)",
    "scheduledTime": "2025-06-26T14:00:00.000Z",
    "repeat": "none",
    "createdAt": 1748316012637,
    "data": {}
  },
  {
    "id": "97fc419b1bc06e1e32fa30d1",
    "title": "Reminder: Pacey's Bday",
    "body": "Due in 61 days (7/26/2025)",
    "scheduledTime": "2025-07-26T14:00:00.000Z",
    "repeat": "none",
    "createdAt": 1748316012638,
    "data": {}
  },
  {
    "id": "4e303d3c233b25ab279716aa",
    "title": "Reminder: Van's Bday",
    "body": "Due in 83 days (8/17/2025)",
    "scheduledTime": "2025-08-16T14:00:00.000Z",
    "repeat": "none",
    "createdAt": 1748316012639,
    "data": {}
  },
  {
    "id": "ddf35e87c90236c7bdeaf5ba",
    "title": "Reminder: Daniela's Bday",
    "body": "Due in 91 days (8/25/2025)",
    "scheduledTime": "2025-08-25T14:00:00.000Z",
    "repeat": "none",
    "createdAt": 1748316012639,
    "data": {}
  },
  {
    "id": "7b3f50eec286ba520080deba",
    "title": "Reminder: Kevin's (me)  Bday !!!!",
    "body": "Due in 128 days (10/1/2025)",
    "scheduledTime": "2025-10-01T14:00:00.000Z",
    "repeat": "none",
    "createdAt": 1748316012639,
    "data": {}
  },
  {
    "id": "adff5757d4d54770a341302f",
    "title": "Reminder: Ben Kim's Bday",
    "body": "Due in 174 days (11/15/2025)",
    "scheduledTime": "2025-11-15T15:00:00.000Z",
    "repeat": "none",
    "createdAt": 1748316012639,
    "data": {}
  },
  {
    "id": "b67b1e7c3a78c565a54b540f",
    "title": "Reminder: Jennifer's Bday",
    "body": "Due in 174 days (11/15/2025)",
    "scheduledTime": "2025-11-15T15:00:00.000Z",
    "repeat": "none",
    "createdAt": 1748316012640,
    "data": {}
  },
  {
    "id": "3ea2bb946d4e1eb8f368be64",
    "title": "Reminder: Nick le Bday",
    "body": "Due in 177 days (11/18/2025)",
    "scheduledTime": "2025-11-18T15:00:00.000Z",
    "repeat": "none",
    "createdAt": 1748316012640,
    "data": {}
  },
  {
    "id": "c5f948bce20c6fcae59b80e7",
    "title": "Reminder: Sneha's Bday",
    "body": "Due in 191 days (12/2/2025)",
    "scheduledTime": "2025-12-01T15:00:00.000Z",
    "repeat": "none",
    "createdAt": 1748316012640,
    "data": {}
  },
  {
    "id": "91a0f002ac5aa3d4ae188757",
    "title": "Reminder: Ali Niaz's Bday",
    "body": "Due in 200 days (12/11/2025)",
    "scheduledTime": "2025-12-11T15:00:00.000Z",
    "repeat": "none",
    "createdAt": 1748316012640,
    "data": {}
  },
  {
    "id": "bf4af299f3c9159bb7fcec2e",
    "title": "Reminder: Kaden's Bday",
    "body": "Due in 203 days (12/14/2025)",
    "scheduledTime": "2025-12-14T15:00:00.000Z",
    "repeat": "none",
    "createdAt": 1748316012641,
    "data": {}
  },
  {
    "id": "f1296950a73ee3da7f1f1be8",
    "title": "Reminder: Dan Do's Bday",
    "body": "Due in 223 days (1/3/2026)",
    "scheduledTime": "2026-01-03T15:00:00.000Z",
    "repeat": "none",
    "createdAt": 1748316012641,
    "data": {}
  },
  {
    "id": "bf0aca9426be00c59fe2d52e",
    "title": "Reminder: Preston's Bday",
    "body": "Due in 224 days (1/4/2026)",
    "scheduledTime": "2026-01-04T15:00:00.000Z",
    "repeat": "none",
    "createdAt": 1748316012641,
    "data": {}
  },
  {
    "id": "e6e801b9dcb793434cf18f20",
    "title": "Reminder: Jerin Binu's Bday",
    "body": "Due in 230 days (1/10/2026)",
    "scheduledTime": "2026-01-10T15:00:00.000Z",
    "repeat": "none",
    "createdAt": 1748316012641,
    "data": {}
  },
  {
    "id": "0c60df607f4a9b6dc2e21653",
    "title": "Reminder: Sannidhi's Bday",
    "body": "Due in 246 days (1/26/2026)",
    "scheduledTime": "2026-01-26T15:00:00.000Z",
    "repeat": "none",
    "createdAt": 1748316012642,
    "data": {}
  },
  {
    "id": "8b6faaae323c93457441db9d",
    "title": "Reminder: Jame's Bday",
    "body": "Due in 256 days (2/5/2026)",
    "scheduledTime": "2026-02-05T15:00:00.000Z",
    "repeat": "none",
    "createdAt": 1748316012642,
    "data": {}
  },
  {
    "id": "5e590e6ca4f06d783018da6b",
    "title": "Reminder: Bryan Nguyen's Bday",
    "body": "Due in 282 days (3/3/2026)",
    "scheduledTime": "2026-03-03T15:00:00.000Z",
    "repeat": "none",
    "createdAt": 1748316012642,
    "data": {}
  },
  {
    "id": "0322631a44280a7cbf7598a1",
    "title": "Reminder: Father's Day",
    "body": "Due in 19 days (6/14/2025)",
    "scheduledTime": "2025-06-13T14:00:00.000Z",
    "repeat": "none",
    "createdAt": 1748316012642,
    "data": {}
  },
  {
    "id": "0707289ed2a30bcca0ca4ecf",
    "title": "Reminder: Lucas Chan's Bday",
    "body": "Due in 249 days (1/29/2026)",
    "scheduledTime": "2026-01-29T15:00:00.000Z",
    "repeat": "none",
    "createdAt": 1748316012642,
    "data": {}
  },
  {
    "id": "4e1b43907e37dd40af29163a",
    "title": "Reminder: Mom's Bday",
    "body": "Due in 277 days (2/26/2026)",
    "scheduledTime": "2026-02-26T15:00:00.000Z",
    "repeat": "none",
    "createdAt": 1748316012643,
    "data": {}
  },
  {
    "id": "cebec13c708abb6e409cc18c",
    "title": "Reminder: Evan's (Cousin) Bday",
    "body": "Due in 61 days (7/26/2025)",
    "scheduledTime": "2025-07-26T14:00:00.000Z",
    "repeat": "none",
    "createdAt": 1748316012643,
    "data": {}
  },
  {
    "id": "f473625ec943ef8e85414220",
    "title": "Reminder: Om's Bday",
    "body": "Due in 45 days (7/10/2025)",
    "scheduledTime": "2025-07-10T14:00:00.000Z",
    "repeat": "none",
    "createdAt": 1748316012644,
    "data": {}
  },
  {
    "id": "9be5a78728d9e80d12eecd0b",
    "title": "Reminder: Anthony Nguyen's Bday",
    "body": "Due in 61 days (7/26/2025)",
    "scheduledTime": "2025-07-26T14:00:00.000Z",
    "repeat": "none",
    "createdAt": 1748316012644,
    "data": {}
  },
  {
    "id": "d04da8aff0dc7d719b5a0e51",
    "title": "Reminder: Dad's Bday",
    "body": "Due in 86 days (8/20/2025)",
    "scheduledTime": "2025-08-19T14:00:00.000Z",
    "repeat": "none",
    "createdAt": 1748316012645,
    "data": {}
  },
  {
    "id": "28a5116ba73b6fe4b270ab22",
    "title": "Reminder: Jason Hammdon's Bday",
    "body": "Due in 175 days (11/16/2025)",
    "scheduledTime": "2025-11-15T15:00:00.000Z",
    "repeat": "none",
    "createdAt": 1748316012645,
    "data": {}
  },
  {
    "id": "b242b2a3bdf039d918273e54",
    "title": "Reminder: Cancel Isaca Membership",
    "body": "Due in 97 days (8/31/2025)",
    "scheduledTime": "2025-08-31T14:00:00.000Z",
    "repeat": "none",
    "createdAt": 1748316012645,
    "data": {}
  },
  {
    "id": "66d22ca502746471de8a98dc",
    "title": "Reminder: Pierson's Bday",
    "body": "Due in 181 days (11/22/2025)",
    "scheduledTime": "2025-11-22T15:00:00.000Z",
    "repeat": "none",
    "createdAt": 1748316012645,
    "data": {}
  },
  {
    "id": "2c58ad9211270c35dc53035c",
    "title": "Reminder: Emiry's Bday",
    "body": "Due in 21 days (6/16/2025)",
    "scheduledTime": "2025-06-15T14:00:00.000Z",
    "repeat": "none",
    "createdAt": 1748316012646,
    "data": {}
  },
  {
    "id": "27a51bbe8770027449224ea4",
    "title": "Reminder: Hogan Nguyen's Bday",
    "body": "Due in 277 days (2/26/2026)",
    "scheduledTime": "2026-02-26T15:00:00.000Z",
    "repeat": "none",
    "createdAt": 1748316012646,
    "data": {}
  },
  {
    "id": "9be11286880701389786f7f9",
    "title": "Reminder: Grace Ebbinghouse's Bday",
    "body": "Due in 44 days (7/9/2025)",
    "scheduledTime": "2025-07-09T14:00:00.000Z",
    "repeat": "none",
    "createdAt": 1748316012646,
    "data": {}
  },
  {
    "id": "9d243df6ad61c7d848178887",
    "title": "Reminder: Mary's Bday",
    "body": "Due in 122 days (9/25/2025)",
    "scheduledTime": "2025-09-24T14:00:00.000Z",
    "repeat": "none",
    "createdAt": 1748316012647,
    "data": {}
  },
  {
    "id": "5d4fd2677a4f1efcccb52725",
    "title": "Reminder: Karans Bday",
    "body": "Due in 18 days (6/13/2025)",
    "scheduledTime": "2025-06-12T14:00:00.000Z",
    "repeat": "none",
    "createdAt": 1748316012647,
    "data": {}
  },
  {
    "id": "b50b269d217626c73f072c09",
    "title": "Reminder: Hannah Wee's Bday",
    "body": "Due in 24 days (6/19/2025)",
    "scheduledTime": "2025-06-19T14:00:00.000Z",
    "repeat": "none",
    "createdAt": 1748316012647,
    "data": {}
  },
  {
    "id": "e1dd878e54d12c84be373e1c",
    "title": "Reminder: Cancel your yearly microsoft 365 subscription",
    "body": "Due in 85 days (8/19/2025)",
    "scheduledTime": "2025-08-19T14:00:00.000Z",
    "repeat": "none",
    "createdAt": 1748316012647,
    "data": {}
  },
  {
    "id": "64a38273b3b7d9e1d7484c5d",
    "title": "Reminder: Brandon Sanchez's Bday",
    "body": "Due in 24 days (6/19/2025)",
    "scheduledTime": "2025-06-19T14:00:00.000Z",
    "repeat": "none",
    "createdAt": 1748316012648,
    "data": {}
  },
  {
    "id": "cceded626b73863501cf06c5",
    "title": "Reminder: Tyler Requa's Bday",
    "body": "Due in 54 days (7/19/2025)",
    "scheduledTime": "2025-07-19T14:00:00.000Z",
    "repeat": "none",
    "createdAt": 1748316012648,
    "data": {}
  },
  {
    "id": "08f2832f6f9e83950da95f63",
    "title": "Reminder: National GF Day",
    "body": "Due in 66 days (7/31/2025)",
    "scheduledTime": "2025-07-30T14:00:00.000Z",
    "repeat": "none",
    "createdAt": 1748316012648,
    "data": {}
  },
  {
    "id": "50a2636706fdb8fcd831b47c",
    "title": "Reminder: Brandon (Nigel) Bday",
    "body": "Due in 171 days (11/12/2025)",
    "scheduledTime": "2025-11-11T15:00:00.000Z",
    "repeat": "none",
    "createdAt": 1748316012648,
    "data": {}
  },
  {
    "id": "8efb03873f37a443fd0d8120",
    "title": "Reminder: Paxton's Bday",
    "body": "Due in 176 days (11/17/2025)",
    "scheduledTime": "2025-11-16T15:00:00.000Z",
    "repeat": "none",
    "createdAt": 1748316012649,
    "data": {}
  },
  {
    "id": "78e6885a31f93e7d5d9b1946",
    "title": "Reminder: David's Bday",
    "body": "Due in 176 days (11/17/2025)",
    "scheduledTime": "2025-11-16T15:00:00.000Z",
    "repeat": "none",
    "createdAt": 1748316012649,
    "data": {}
  },
  {
    "id": "da4f1649712de86ab6f0e0ef",
    "title": "Reminder: Kyduyen's Bday",
    "body": "Due in 185 days (11/26/2025)",
    "scheduledTime": "2025-11-25T15:00:00.000Z",
    "repeat": "none",
    "createdAt": 1748316012649,
    "data": {}
  },
  {
    "id": "b4f7535cf28128ea8c32954d",
    "title": "Reminder: Kai Fernando's Bday",
    "body": "Due in 191 days (12/2/2025)",
    "scheduledTime": "2025-12-02T15:00:00.000Z",
    "repeat": "none",
    "createdAt": 1748316012650,
    "data": {}
  },
  {
    "id": "35eba2c07fea673c3b9b53e9",
    "title": "Reminder: Cooper's Bday",
    "body": "Due in 217 days (12/28/2025)",
    "scheduledTime": "2025-12-28T15:00:00.000Z",
    "repeat": "none",
    "createdAt": 1748316012650,
    "data": {}
  },
  {
    "id": "62cd8a0b51e764a71d3842ee",
    "title": "Reminder: Andre Sae's Bday",
    "body": "Due in 239 days (1/19/2026)",
    "scheduledTime": "2026-01-19T15:00:00.000Z",
    "repeat": "none",
    "createdAt": 1748316012650,
    "data": {}
  },
  {
    "id": "d3ecaf855286eca526fcfc92",
    "title": "Reminder: Kayla's Bday",
    "body": "Due in 251 days (1/31/2026)",
    "scheduledTime": "2026-01-31T15:00:00.000Z",
    "repeat": "none",
    "createdAt": 1748316012651,
    "data": {}
  },
  {
    "id": "3af63ad9491969d5c64a0b23",
    "title": "Reminder: Rafael's Bday",
    "body": "Due in 258 days (2/7/2026)",
    "scheduledTime": "2026-02-07T15:00:00.000Z",
    "repeat": "none",
    "createdAt": 1748316012651,
    "data": {}
  },
  {
    "id": "1f182d6df98e2f3d932187de",
    "title": "Reminder: Aadarsh's Bday",
    "body": "Due in 276 days (2/25/2026)",
    "scheduledTime": "2026-02-25T15:00:00.000Z",
    "repeat": "none",
    "createdAt": 1748316012652,
    "data": {}
  },
  {
    "id": "49e2c580d6ec83e1572eb1d6",
    "title": "Reminder: Ethan Hoang's Bday",
    "body": "Due in 280 days (3/1/2026)",
    "scheduledTime": "2026-03-01T15:00:00.000Z",
    "repeat": "none",
    "createdAt": 1748316012652,
    "data": {}
  },
  {
    "id": "23f5f5ab3f434b06f1b96887",
    "title": "Reminder: Tracie's Bday",
    "body": "Due in 312 days (4/3/2026)",
    "scheduledTime": "2026-04-03T14:00:00.000Z",
    "repeat": "none",
    "createdAt": 1748316012652,
    "data": {}
  },
  {
    "id": "e9fb32e559ee6fc85cc1e7b9",
    "title": "Reminder: Robert Herrerahs Bday",
    "body": "Due in 9 days (6/4/2025)",
    "scheduledTime": "2025-06-03T14:00:00.000Z",
    "repeat": "none",
    "createdAt": 1748316012653,
    "data": {}
  },
  {
    "id": "418d36b62769514cbf0a1a9c",
    "title": "Reminder: Calina's Bday",
    "body": "Due in 126 days (9/29/2025)",
    "scheduledTime": "2025-09-28T14:00:00.000Z",
    "repeat": "none",
    "createdAt": 1748316012653,
    "data": {}
  },
  {
    "id": "f217e70e5036725c99e114e0",
    "title": "Reminder: Update your christmas list and send it to people especially Kayla",
    "body": "Due in 200 days (12/11/2025)",
    "scheduledTime": "2025-12-11T15:00:00.000Z",
    "repeat": "none",
    "createdAt": 1748316012653,
    "data": {}
  },
  {
    "id": "f68891ccbed4970406747113",
    "title": "Reminder: Oscar's Bday",
    "body": "Due in 18 days (6/13/2025)",
    "scheduledTime": "2025-06-12T14:00:00.000Z",
    "repeat": "none",
    "createdAt": 1748316012653,
    "data": {}
  },
  {
    "id": "24c6fe066c5ea460d5e17a57",
    "title": "Reminder: Shelly's Bday",
    "body": "Due in 163 days (11/4/2025)",
    "scheduledTime": "2025-11-03T15:00:00.000Z",
    "repeat": "none",
    "createdAt": 1748316012654,
    "data": {}
  },
  {
    "id": "6a34873d646762a119214cbf",
    "title": "Reminder: Neil's Bday",
    "body": "Due in 264 days (2/13/2026)",
    "scheduledTime": "2026-02-13T15:00:00.000Z",
    "repeat": "none",
    "createdAt": 1748316012654,
    "data": {}
  },
  {
    "id": "fd11fcceee42c3bf738a0c8b",
    "title": "Reminder: Connor Pham's Bday",
    "body": "Due in 30 days (6/26/2025)",
    "scheduledTime": "2025-06-26T14:00:00.000Z",
    "repeat": "none",
    "createdAt": 1748370803781,
    "data": {}
  },
  {
    "id": "39a29c496143688b2608290e",
    "title": "Reminder: Alvin Matthew's Bday",
    "body": "Due in 30 days (6/26/2025)",
    "scheduledTime": "2025-06-26T14:00:00.000Z",
    "repeat": "none",
    "createdAt": 1748370803782,
    "data": {}
  },
  {
    "id": "ede278febc962d3b6dadb839",
    "title": "Reminder: Pacey's Bday",
    "body": "Due in 60 days (7/26/2025)",
    "scheduledTime": "2025-07-26T14:00:00.000Z",
    "repeat": "none",
    "createdAt": 1748370803782,
    "data": {}
  },
  {
    "id": "07056fcc38a01cdbc09d72ef",
    "title": "Reminder: Van's Bday",
    "body": "Due in 82 days (8/17/2025)",
    "scheduledTime": "2025-08-16T14:00:00.000Z",
    "repeat": "none",
    "createdAt": 1748370803783,
    "data": {}
  },
  {
    "id": "001cc62b622e93c064c8d42e",
    "title": "Reminder: Daniela's Bday",
    "body": "Due in 90 days (8/25/2025)",
    "scheduledTime": "2025-08-25T14:00:00.000Z",
    "repeat": "none",
    "createdAt": 1748370803783,
    "data": {}
  },
  {
    "id": "ceda0d59f47022cf7b150556",
    "title": "Reminder: Kevin's (me)  Bday !!!!",
    "body": "Due in 127 days (10/1/2025)",
    "scheduledTime": "2025-10-01T14:00:00.000Z",
    "repeat": "none",
    "createdAt": 1748370803783,
    "data": {}
  },
  {
    "id": "bad3cfaf7b7d789c5edb7e97",
    "title": "Reminder: Ben Kim's Bday",
    "body": "Due in 173 days (11/15/2025)",
    "scheduledTime": "2025-11-15T15:00:00.000Z",
    "repeat": "none",
    "createdAt": 1748370803784,
    "data": {}
  },
  {
    "id": "080c372faf64e02a39c43d72",
    "title": "Reminder: Jennifer's Bday",
    "body": "Due in 173 days (11/15/2025)",
    "scheduledTime": "2025-11-15T15:00:00.000Z",
    "repeat": "none",
    "createdAt": 1748370803784,
    "data": {}
  },
  {
    "id": "473a32f7ef77b69aab116da7",
    "title": "Reminder: Nick le Bday",
    "body": "Due in 176 days (11/18/2025)",
    "scheduledTime": "2025-11-18T15:00:00.000Z",
    "repeat": "none",
    "createdAt": 1748370803785,
    "data": {}
  },
  {
    "id": "4f106e5ac7495473bd440470",
    "title": "Reminder: Sneha's Bday",
    "body": "Due in 190 days (12/2/2025)",
    "scheduledTime": "2025-12-01T15:00:00.000Z",
    "repeat": "none",
    "createdAt": 1748370803785,
    "data": {}
  },
  {
    "id": "9d367d288d154dcc9cbc279b",
    "title": "Reminder: Ali Niaz's Bday",
    "body": "Due in 199 days (12/11/2025)",
    "scheduledTime": "2025-12-11T15:00:00.000Z",
    "repeat": "none",
    "createdAt": 1748370803786,
    "data": {}
  },
  {
    "id": "2744c647ff999030690fa09b",
    "title": "Reminder: Kaden's Bday",
    "body": "Due in 202 days (12/14/2025)",
    "scheduledTime": "2025-12-14T15:00:00.000Z",
    "repeat": "none",
    "createdAt": 1748370803786,
    "data": {}
  },
  {
    "id": "ba5365c16b2bbb05ee8f63a0",
    "title": "Reminder: Dan Do's Bday",
    "body": "Due in 222 days (1/3/2026)",
    "scheduledTime": "2026-01-03T15:00:00.000Z",
    "repeat": "none",
    "createdAt": 1748370803786,
    "data": {}
  },
  {
    "id": "07b1e6a521f6eb384ce54b47",
    "title": "Reminder: Preston's Bday",
    "body": "Due in 223 days (1/4/2026)",
    "scheduledTime": "2026-01-04T15:00:00.000Z",
    "repeat": "none",
    "createdAt": 1748370803787,
    "data": {}
  },
  {
    "id": "57c61c0dbed47ad4b92a749f",
    "title": "Reminder: Jerin Binu's Bday",
    "body": "Due in 229 days (1/10/2026)",
    "scheduledTime": "2026-01-10T15:00:00.000Z",
    "repeat": "none",
    "createdAt": 1748370803787,
    "data": {}
  },
  {
    "id": "db4f695d0935fec47069df7e",
    "title": "Reminder: Sannidhi's Bday",
    "body": "Due in 245 days (1/26/2026)",
    "scheduledTime": "2026-01-26T15:00:00.000Z",
    "repeat": "none",
    "createdAt": 1748370803788,
    "data": {}
  },
  {
    "id": "c0c9feffc563da56036ba385",
    "title": "Reminder: Jame's Bday",
    "body": "Due in 255 days (2/5/2026)",
    "scheduledTime": "2026-02-05T15:00:00.000Z",
    "repeat": "none",
    "createdAt": 1748370803788,
    "data": {}
  },
  {
    "id": "5c9933174f7e292606dcf93f",
    "title": "Reminder: Bryan Nguyen's Bday",
    "body": "Due in 281 days (3/3/2026)",
    "scheduledTime": "2026-03-03T15:00:00.000Z",
    "repeat": "none",
    "createdAt": 1748370803788,
    "data": {}
  },
  {
    "id": "5e9280223fc150d05c1401bb",
    "title": "Reminder: Father's Day",
    "body": "Due in 18 days (6/14/2025)",
    "scheduledTime": "2025-06-13T14:00:00.000Z",
    "repeat": "none",
    "createdAt": 1748370803789,
    "data": {}
  },
  {
    "id": "ccab7c1fda74a16a547923f9",
    "title": "Reminder: Lucas Chan's Bday",
    "body": "Due in 248 days (1/29/2026)",
    "scheduledTime": "2026-01-29T15:00:00.000Z",
    "repeat": "none",
    "createdAt": 1748370803789,
    "data": {}
  },
  {
    "id": "e9915341e534ab95394f1e39",
    "title": "Reminder: Mom's Bday",
    "body": "Due in 276 days (2/26/2026)",
    "scheduledTime": "2026-02-26T15:00:00.000Z",
    "repeat": "none",
    "createdAt": 1748370803789,
    "data": {}
  },
  {
    "id": "962d76a414f6a958f185b699",
    "title": "Reminder: Evan's (Cousin) Bday",
    "body": "Due in 60 days (7/26/2025)",
    "scheduledTime": "2025-07-26T14:00:00.000Z",
    "repeat": "none",
    "createdAt": 1748370803790,
    "data": {}
  },
  {
    "id": "b7111f1d364fdd436f269163",
    "title": "Reminder: Om's Bday",
    "body": "Due in 44 days (7/10/2025)",
    "scheduledTime": "2025-07-10T14:00:00.000Z",
    "repeat": "none",
    "createdAt": 1748370803790,
    "data": {}
  },
  {
    "id": "69b9a0fb6d288a50fe26960e",
    "title": "Reminder: Anthony Nguyen's Bday",
    "body": "Due in 60 days (7/26/2025)",
    "scheduledTime": "2025-07-26T14:00:00.000Z",
    "repeat": "none",
    "createdAt": 1748370803791,
    "data": {}
  },
  {
    "id": "4ef68058a3a082ef15162bb3",
    "title": "Reminder: Dad's Bday",
    "body": "Due in 85 days (8/20/2025)",
    "scheduledTime": "2025-08-19T14:00:00.000Z",
    "repeat": "none",
    "createdAt": 1748370803791,
    "data": {}
  },
  {
    "id": "e6433a85543b70bb442f3886",
    "title": "Reminder: Jason Hammdon's Bday",
    "body": "Due in 174 days (11/16/2025)",
    "scheduledTime": "2025-11-15T15:00:00.000Z",
    "repeat": "none",
    "createdAt": 1748370803791,
    "data": {}
  },
  {
    "id": "3a7b66f48a27a269f70fc066",
    "title": "Reminder: Cancel Isaca Membership",
    "body": "Due in 96 days (8/31/2025)",
    "scheduledTime": "2025-08-31T14:00:00.000Z",
    "repeat": "none",
    "createdAt": 1748370803792,
    "data": {}
  },
  {
    "id": "25cf7714c93045174a0b2b44",
    "title": "Reminder: Pierson's Bday",
    "body": "Due in 180 days (11/22/2025)",
    "scheduledTime": "2025-11-22T15:00:00.000Z",
    "repeat": "none",
    "createdAt": 1748370803792,
    "data": {}
  },
  {
    "id": "7f2d47ba0def9ec5d4da5280",
    "title": "Reminder: Emiry's Bday",
    "body": "Due in 20 days (6/16/2025)",
    "scheduledTime": "2025-06-15T14:00:00.000Z",
    "repeat": "none",
    "createdAt": 1748370803792,
    "data": {}
  },
  {
    "id": "7ef77d6fb7aa6e47144170f9",
    "title": "Reminder: Hogan Nguyen's Bday",
    "body": "Due in 276 days (2/26/2026)",
    "scheduledTime": "2026-02-26T15:00:00.000Z",
    "repeat": "none",
    "createdAt": 1748370803792,
    "data": {}
  },
  {
    "id": "fc89232d1f9a9b63a07c814e",
    "title": "Reminder: Grace Ebbinghouse's Bday",
    "body": "Due in 43 days (7/9/2025)",
    "scheduledTime": "2025-07-09T14:00:00.000Z",
    "repeat": "none",
    "createdAt": 1748370803793,
    "data": {}
  },
  {
    "id": "f9a477ad53aff80df0c4cf4a",
    "title": "Reminder: Mary's Bday",
    "body": "Due in 121 days (9/25/2025)",
    "scheduledTime": "2025-09-24T14:00:00.000Z",
    "repeat": "none",
    "createdAt": 1748370803793,
    "data": {}
  },
  {
    "id": "ee7b7c129b4aa59afd2a48a8",
    "title": "Reminder: Karans Bday",
    "body": "Due in 17 days (6/13/2025)",
    "scheduledTime": "2025-06-12T14:00:00.000Z",
    "repeat": "none",
    "createdAt": 1748370803794,
    "data": {}
  },
  {
    "id": "5de15b821238164a9ea908c3",
    "title": "Reminder: Hannah Wee's Bday",
    "body": "Due in 23 days (6/19/2025)",
    "scheduledTime": "2025-06-19T14:00:00.000Z",
    "repeat": "none",
    "createdAt": 1748370803794,
    "data": {}
  },
  {
    "id": "ad505d8e43e4eb344b2b08d4",
    "title": "Reminder: Cancel your yearly microsoft 365 subscription",
    "body": "Due in 84 days (8/19/2025)",
    "scheduledTime": "2025-08-19T14:00:00.000Z",
    "repeat": "none",
    "createdAt": 1748370803794,
    "data": {}
  },
  {
    "id": "36bde62dfce6c5e14c505c44",
    "title": "Reminder: Brandon Sanchez's Bday",
    "body": "Due in 23 days (6/19/2025)",
    "scheduledTime": "2025-06-19T14:00:00.000Z",
    "repeat": "none",
    "createdAt": 1748370803795,
    "data": {}
  },
  {
    "id": "e128937ab71a1cd1b41cde8e",
    "title": "Reminder: Tyler Requa's Bday",
    "body": "Due in 53 days (7/19/2025)",
    "scheduledTime": "2025-07-19T14:00:00.000Z",
    "repeat": "none",
    "createdAt": 1748370803795,
    "data": {}
  },
  {
    "id": "aee79998ee63ba17bed626c8",
    "title": "Reminder: National GF Day",
    "body": "Due in 65 days (7/31/2025)",
    "scheduledTime": "2025-07-30T14:00:00.000Z",
    "repeat": "none",
    "createdAt": 1748370803796,
    "data": {}
  },
  {
    "id": "78c7072b934273b40527653f",
    "title": "Reminder: Brandon (Nigel) Bday",
    "body": "Due in 170 days (11/12/2025)",
    "scheduledTime": "2025-11-11T15:00:00.000Z",
    "repeat": "none",
    "createdAt": 1748370803796,
    "data": {}
  },
  {
    "id": "e0d49cd11c4a45b59de44d6f",
    "title": "Reminder: Paxton's Bday",
    "body": "Due in 175 days (11/17/2025)",
    "scheduledTime": "2025-11-16T15:00:00.000Z",
    "repeat": "none",
    "createdAt": 1748370803796,
    "data": {}
  },
  {
    "id": "533696a77d7bce9af649dc23",
    "title": "Reminder: David's Bday",
    "body": "Due in 175 days (11/17/2025)",
    "scheduledTime": "2025-11-16T15:00:00.000Z",
    "repeat": "none",
    "createdAt": 1748370803797,
    "data": {}
  },
  {
    "id": "44d7131f5aba80429fda8719",
    "title": "Reminder: Kyduyen's Bday",
    "body": "Due in 184 days (11/26/2025)",
    "scheduledTime": "2025-11-25T15:00:00.000Z",
    "repeat": "none",
    "createdAt": 1748370803797,
    "data": {}
  },
  {
    "id": "f0ac9d42cb0805528a595f44",
    "title": "Reminder: Kai Fernando's Bday",
    "body": "Due in 190 days (12/2/2025)",
    "scheduledTime": "2025-12-02T15:00:00.000Z",
    "repeat": "none",
    "createdAt": 1748370803797,
    "data": {}
  },
  {
    "id": "64132970b4bf4437e6ac7493",
    "title": "Reminder: Cooper's Bday",
    "body": "Due in 216 days (12/28/2025)",
    "scheduledTime": "2025-12-28T15:00:00.000Z",
    "repeat": "none",
    "createdAt": 1748370803797,
    "data": {}
  },
  {
    "id": "d3cb97cb30e07144184d2bcd",
    "title": "Reminder: Andre Sae's Bday",
    "body": "Due in 238 days (1/19/2026)",
    "scheduledTime": "2026-01-19T15:00:00.000Z",
    "repeat": "none",
    "createdAt": 1748370803798,
    "data": {}
  },
  {
    "id": "9f4e5c21d9020cace2dd0355",
    "title": "Reminder: Kayla's Bday",
    "body": "Due in 250 days (1/31/2026)",
    "scheduledTime": "2026-01-31T15:00:00.000Z",
    "repeat": "none",
    "createdAt": 1748370803798,
    "data": {}
  },
  {
    "id": "ed03fa03b4f3baabc5186485",
    "title": "Reminder: Rafael's Bday",
    "body": "Due in 257 days (2/7/2026)",
    "scheduledTime": "2026-02-07T15:00:00.000Z",
    "repeat": "none",
    "createdAt": 1748370803798,
    "data": {}
  },
  {
    "id": "6b9411a544da482b8d76d67a",
    "title": "Reminder: Aadarsh's Bday",
    "body": "Due in 275 days (2/25/2026)",
    "scheduledTime": "2026-02-25T15:00:00.000Z",
    "repeat": "none",
    "createdAt": 1748370803798,
    "data": {}
  },
  {
    "id": "7d4705e800af0ac52cf58cfb",
    "title": "Reminder: Ethan Hoang's Bday",
    "body": "Due in 279 days (3/1/2026)",
    "scheduledTime": "2026-03-01T15:00:00.000Z",
    "repeat": "none",
    "createdAt": 1748370803799,
    "data": {}
  },
  {
    "id": "fde56f722a8841c55dc24b90",
    "title": "Reminder: Tracie's Bday",
    "body": "Due in 311 days (4/3/2026)",
    "scheduledTime": "2026-04-03T14:00:00.000Z",
    "repeat": "none",
    "createdAt": 1748370803800,
    "data": {}
  },
  {
    "id": "1e136dd403ddb175f6d41d7f",
    "title": "Reminder: Robert Herrerahs Bday",
    "body": "Due in 8 days (6/4/2025)",
    "scheduledTime": "2025-06-03T14:00:00.000Z",
    "repeat": "none",
    "createdAt": 1748370803801,
    "data": {}
  },
  {
    "id": "3205a05d3e314e7c38f139d2",
    "title": "Reminder: Calina's Bday",
    "body": "Due in 125 days (9/29/2025)",
    "scheduledTime": "2025-09-28T14:00:00.000Z",
    "repeat": "none",
    "createdAt": 1748370803801,
    "data": {}
  },
  {
    "id": "95499d43563e374c46451a10",
    "title": "Reminder: Update your christmas list and send it to people especially Kayla",
    "body": "Due in 199 days (12/11/2025)",
    "scheduledTime": "2025-12-11T15:00:00.000Z",
    "repeat": "none",
    "createdAt": 1748370803802,
    "data": {}
  },
  {
    "id": "c94d0d519a819ffd738911b4",
    "title": "Reminder: Oscar's Bday",
    "body": "Due in 17 days (6/13/2025)",
    "scheduledTime": "2025-06-12T14:00:00.000Z",
    "repeat": "none",
    "createdAt": 1748370803802,
    "data": {}
  },
  {
    "id": "e355b21b49987b942a3a75fa",
    "title": "Reminder: Shelly's Bday",
    "body": "Due in 162 days (11/4/2025)",
    "scheduledTime": "2025-11-03T15:00:00.000Z",
    "repeat": "none",
    "createdAt": 1748370803802,
    "data": {}
  },
  {
    "id": "f57b98487599e2ff18f14f0f",
    "title": "Reminder: Neil's Bday",
    "body": "Due in 263 days (2/13/2026)",
    "scheduledTime": "2026-02-13T15:00:00.000Z",
    "repeat": "none",
    "createdAt": 1748370803803,
    "data": {}
  },
  {
    "id": "74b8488bbd5fad7e64026963",
    "title": "Reminder: Connor Pham's Bday",
    "body": "Due in 29 days (6/26/2025)",
    "scheduledTime": "2025-06-26T14:00:00.000Z",
    "repeat": "none",
    "createdAt": 1748443361685,
    "data": {}
  },
  {
    "id": "0bb922c2dcf428598f647686",
    "title": "Reminder: Alvin Matthew's Bday",
    "body": "Due in 29 days (6/26/2025)",
    "scheduledTime": "2025-06-26T14:00:00.000Z",
    "repeat": "none",
    "createdAt": 1748443361685,
    "data": {}
  },
  {
    "id": "c383d6a42bb3811e835ed105",
    "title": "Reminder: Pacey's Bday",
    "body": "Due in 59 days (7/26/2025)",
    "scheduledTime": "2025-07-26T14:00:00.000Z",
    "repeat": "none",
    "createdAt": 1748443361686,
    "data": {}
  },
  {
    "id": "a812903b0f45389f05ff355a",
    "title": "Reminder: Van's Bday",
    "body": "Due in 81 days (8/17/2025)",
    "scheduledTime": "2025-08-16T14:00:00.000Z",
    "repeat": "none",
    "createdAt": 1748443361686,
    "data": {}
  },
  {
    "id": "62bb6fa30dd813cf25c92258",
    "title": "Reminder: Daniela's Bday",
    "body": "Due in 89 days (8/25/2025)",
    "scheduledTime": "2025-08-25T14:00:00.000Z",
    "repeat": "none",
    "createdAt": 1748443361686,
    "data": {}
  },
  {
    "id": "f54dd2b110e04c21c44a9f19",
    "title": "Reminder: Kevin's (me)  Bday !!!!",
    "body": "Due in 126 days (10/1/2025)",
    "scheduledTime": "2025-10-01T14:00:00.000Z",
    "repeat": "none",
    "createdAt": 1748443361687,
    "data": {}
  },
  {
    "id": "ce503e7c4db4eec699fad038",
    "title": "Reminder: Ben Kim's Bday",
    "body": "Due in 172 days (11/15/2025)",
    "scheduledTime": "2025-11-15T15:00:00.000Z",
    "repeat": "none",
    "createdAt": 1748443361687,
    "data": {}
  },
  {
    "id": "6039cbe9eaf6b15fa6569f6f",
    "title": "Reminder: Jennifer's Bday",
    "body": "Due in 172 days (11/15/2025)",
    "scheduledTime": "2025-11-15T15:00:00.000Z",
    "repeat": "none",
    "createdAt": 1748443361688,
    "data": {}
  },
  {
    "id": "64b7250697f6bf636dafb885",
    "title": "Reminder: Nick le Bday",
    "body": "Due in 175 days (11/18/2025)",
    "scheduledTime": "2025-11-18T15:00:00.000Z",
    "repeat": "none",
    "createdAt": 1748443361688,
    "data": {}
  },
  {
    "id": "293d68bfb98e3854624aac65",
    "title": "Reminder: Sneha's Bday",
    "body": "Due in 189 days (12/2/2025)",
    "scheduledTime": "2025-12-01T15:00:00.000Z",
    "repeat": "none",
    "createdAt": 1748443361689,
    "data": {}
  },
  {
    "id": "f248c9178a1cf669ac608ee4",
    "title": "Reminder: Ali Niaz's Bday",
    "body": "Due in 198 days (12/11/2025)",
    "scheduledTime": "2025-12-11T15:00:00.000Z",
    "repeat": "none",
    "createdAt": 1748443361689,
    "data": {}
  },
  {
    "id": "374860718f0952877b3929c6",
    "title": "Reminder: Kaden's Bday",
    "body": "Due in 201 days (12/14/2025)",
    "scheduledTime": "2025-12-14T15:00:00.000Z",
    "repeat": "none",
    "createdAt": 1748443361689,
    "data": {}
  },
  {
    "id": "b894fbfd0e98b9e0f821f168",
    "title": "Reminder: Dan Do's Bday",
    "body": "Due in 221 days (1/3/2026)",
    "scheduledTime": "2026-01-03T15:00:00.000Z",
    "repeat": "none",
    "createdAt": 1748443361690,
    "data": {}
  },
  {
    "id": "659cfb6605e751a8e83e95a3",
    "title": "Reminder: Preston's Bday",
    "body": "Due in 222 days (1/4/2026)",
    "scheduledTime": "2026-01-04T15:00:00.000Z",
    "repeat": "none",
    "createdAt": 1748443361690,
    "data": {}
  },
  {
    "id": "9c811aa00e017e27336b3877",
    "title": "Reminder: Jerin Binu's Bday",
    "body": "Due in 228 days (1/10/2026)",
    "scheduledTime": "2026-01-10T15:00:00.000Z",
    "repeat": "none",
    "createdAt": 1748443361691,
    "data": {}
  },
  {
    "id": "cd76fee7415d108c2c4a9ec7",
    "title": "Reminder: Sannidhi's Bday",
    "body": "Due in 244 days (1/26/2026)",
    "scheduledTime": "2026-01-26T15:00:00.000Z",
    "repeat": "none",
    "createdAt": 1748443361691,
    "data": {}
  },
  {
    "id": "a860070b8675866c81f881db",
    "title": "Reminder: Jame's Bday",
    "body": "Due in 254 days (2/5/2026)",
    "scheduledTime": "2026-02-05T15:00:00.000Z",
    "repeat": "none",
    "createdAt": 1748443361691,
    "data": {}
  },
  {
    "id": "1d178d08c1d69d2872c1309f",
    "title": "Reminder: Bryan Nguyen's Bday",
    "body": "Due in 280 days (3/3/2026)",
    "scheduledTime": "2026-03-03T15:00:00.000Z",
    "repeat": "none",
    "createdAt": 1748443361691,
    "data": {}
  },
  {
    "id": "631647ed7ca5cc55d7e51bb4",
    "title": "Reminder: Father's Day",
    "body": "Due in 17 days (6/14/2025)",
    "scheduledTime": "2025-06-13T14:00:00.000Z",
    "repeat": "none",
    "createdAt": 1748443361692,
    "data": {}
  },
  {
    "id": "5cad32d0ada9fbaa176107d8",
    "title": "Reminder: Lucas Chan's Bday",
    "body": "Due in 247 days (1/29/2026)",
    "scheduledTime": "2026-01-29T15:00:00.000Z",
    "repeat": "none",
    "createdAt": 1748443361692,
    "data": {}
  },
  {
    "id": "b453588beb372c3fbecfef6d",
    "title": "Reminder: Mom's Bday",
    "body": "Due in 275 days (2/26/2026)",
    "scheduledTime": "2026-02-26T15:00:00.000Z",
    "repeat": "none",
    "createdAt": 1748443361692,
    "data": {}
  },
  {
    "id": "42ff86661746497b68b66fe7",
    "title": "Reminder: Evan's (Cousin) Bday",
    "body": "Due in 59 days (7/26/2025)",
    "scheduledTime": "2025-07-26T14:00:00.000Z",
    "repeat": "none",
    "createdAt": 1748443361693,
    "data": {}
  },
  {
    "id": "5721e011b1d75eec45702c21",
    "title": "Reminder: Om's Bday",
    "body": "Due in 43 days (7/10/2025)",
    "scheduledTime": "2025-07-10T14:00:00.000Z",
    "repeat": "none",
    "createdAt": 1748443361693,
    "data": {}
  },
  {
    "id": "c293774c1605de4cdb81fb21",
    "title": "Reminder: Anthony Nguyen's Bday",
    "body": "Due in 59 days (7/26/2025)",
    "scheduledTime": "2025-07-26T14:00:00.000Z",
    "repeat": "none",
    "createdAt": 1748443361693,
    "data": {}
  },
  {
    "id": "f30987a3c5aa4412529dc487",
    "title": "Reminder: Dad's Bday",
    "body": "Due in 84 days (8/20/2025)",
    "scheduledTime": "2025-08-19T14:00:00.000Z",
    "repeat": "none",
    "createdAt": 1748443361694,
    "data": {}
  },
  {
    "id": "fcfa2395c8e40f91b8f44605",
    "title": "Reminder: Jason Hammdon's Bday",
    "body": "Due in 173 days (11/16/2025)",
    "scheduledTime": "2025-11-15T15:00:00.000Z",
    "repeat": "none",
    "createdAt": 1748443361694,
    "data": {}
  },
  {
    "id": "021084810c6bf94653b722e1",
    "title": "Reminder: Cancel Isaca Membership",
    "body": "Due in 95 days (8/31/2025)",
    "scheduledTime": "2025-08-31T14:00:00.000Z",
    "repeat": "none",
    "createdAt": 1748443361694,
    "data": {}
  },
  {
    "id": "7c210a2141c48697190d9976",
    "title": "Reminder: Pierson's Bday",
    "body": "Due in 179 days (11/22/2025)",
    "scheduledTime": "2025-11-22T15:00:00.000Z",
    "repeat": "none",
    "createdAt": 1748443361695,
    "data": {}
  },
  {
    "id": "9982d55abc94c0ae81221324",
    "title": "Reminder: Emiry's Bday",
    "body": "Due in 19 days (6/16/2025)",
    "scheduledTime": "2025-06-15T14:00:00.000Z",
    "repeat": "none",
    "createdAt": 1748443361695,
    "data": {}
  },
  {
    "id": "354d51c233b001787405a8dd",
    "title": "Reminder: Hogan Nguyen's Bday",
    "body": "Due in 275 days (2/26/2026)",
    "scheduledTime": "2026-02-26T15:00:00.000Z",
    "repeat": "none",
    "createdAt": 1748443361695,
    "data": {}
  },
  {
    "id": "c71e6c713be338ea13ea6db2",
    "title": "Reminder: Grace Ebbinghouse's Bday",
    "body": "Due in 42 days (7/9/2025)",
    "scheduledTime": "2025-07-09T14:00:00.000Z",
    "repeat": "none",
    "createdAt": 1748443361696,
    "data": {}
  },
  {
    "id": "4cef0c1881e73046f55bf4e6",
    "title": "Reminder: Mary's Bday",
    "body": "Due in 120 days (9/25/2025)",
    "scheduledTime": "2025-09-24T14:00:00.000Z",
    "repeat": "none",
    "createdAt": 1748443361696,
    "data": {}
  },
  {
    "id": "c02a7794781930e3c166fbf6",
    "title": "Reminder: Karans Bday",
    "body": "Due in 16 days (6/13/2025)",
    "scheduledTime": "2025-06-12T14:00:00.000Z",
    "repeat": "none",
    "createdAt": 1748443361696,
    "data": {}
  },
  {
    "id": "2a0b1f126f83a02399f0238c",
    "title": "Reminder: Hannah Wee's Bday",
    "body": "Due in 22 days (6/19/2025)",
    "scheduledTime": "2025-06-19T14:00:00.000Z",
    "repeat": "none",
    "createdAt": 1748443361696,
    "data": {}
  },
  {
    "id": "c9157aeee6476fb833641f4b",
    "title": "Reminder: Cancel your yearly microsoft 365 subscription",
    "body": "Due in 83 days (8/19/2025)",
    "scheduledTime": "2025-08-19T14:00:00.000Z",
    "repeat": "none",
    "createdAt": 1748443361697,
    "data": {}
  },
  {
    "id": "7862748c31017d3a2c91a3b0",
    "title": "Reminder: Brandon Sanchez's Bday",
    "body": "Due in 22 days (6/19/2025)",
    "scheduledTime": "2025-06-19T14:00:00.000Z",
    "repeat": "none",
    "createdAt": 1748443361697,
    "data": {}
  },
  {
    "id": "4f9dc9da4dbcff27cd847e8e",
    "title": "Reminder: Tyler Requa's Bday",
    "body": "Due in 52 days (7/19/2025)",
    "scheduledTime": "2025-07-19T14:00:00.000Z",
    "repeat": "none",
    "createdAt": 1748443361697,
    "data": {}
  },
  {
    "id": "40f96a1258c9e5cccf9641fc",
    "title": "Reminder: National GF Day",
    "body": "Due in 64 days (7/31/2025)",
    "scheduledTime": "2025-07-30T14:00:00.000Z",
    "repeat": "none",
    "createdAt": 1748443361698,
    "data": {}
  },
  {
    "id": "fce244ff1d3e1c34005beedb",
    "title": "Reminder: Brandon (Nigel) Bday",
    "body": "Due in 169 days (11/12/2025)",
    "scheduledTime": "2025-11-11T15:00:00.000Z",
    "repeat": "none",
    "createdAt": 1748443361698,
    "data": {}
  },
  {
    "id": "fd0c14c4b23e33d439be2208",
    "title": "Reminder: Paxton's Bday",
    "body": "Due in 174 days (11/17/2025)",
    "scheduledTime": "2025-11-16T15:00:00.000Z",
    "repeat": "none",
    "createdAt": 1748443361698,
    "data": {}
  },
  {
    "id": "8b195d3941082e96b59437ed",
    "title": "Reminder: David's Bday",
    "body": "Due in 174 days (11/17/2025)",
    "scheduledTime": "2025-11-16T15:00:00.000Z",
    "repeat": "none",
    "createdAt": 1748443361698,
    "data": {}
  },
  {
    "id": "0412d6be9fe825796b26e6ad",
    "title": "Reminder: Kyduyen's Bday",
    "body": "Due in 183 days (11/26/2025)",
    "scheduledTime": "2025-11-25T15:00:00.000Z",
    "repeat": "none",
    "createdAt": 1748443361699,
    "data": {}
  },
  {
    "id": "f72a54b2878ca501660b7f48",
    "title": "Reminder: Kai Fernando's Bday",
    "body": "Due in 189 days (12/2/2025)",
    "scheduledTime": "2025-12-02T15:00:00.000Z",
    "repeat": "none",
    "createdAt": 1748443361699,
    "data": {}
  },
  {
    "id": "14974cef05f47030645729a8",
    "title": "Reminder: Cooper's Bday",
    "body": "Due in 215 days (12/28/2025)",
    "scheduledTime": "2025-12-28T15:00:00.000Z",
    "repeat": "none",
    "createdAt": 1748443361699,
    "data": {}
  },
  {
    "id": "3fd1baf66edaa9230b00d5dc",
    "title": "Reminder: Andre Sae's Bday",
    "body": "Due in 237 days (1/19/2026)",
    "scheduledTime": "2026-01-19T15:00:00.000Z",
    "repeat": "none",
    "createdAt": 1748443361700,
    "data": {}
  },
  {
    "id": "b155f856c2a76caf693626e9",
    "title": "Reminder: Kayla's Bday",
    "body": "Due in 249 days (1/31/2026)",
    "scheduledTime": "2026-01-31T15:00:00.000Z",
    "repeat": "none",
    "createdAt": 1748443361700,
    "data": {}
  },
  {
    "id": "2884eff4010036b73deb7d29",
    "title": "Reminder: Rafael's Bday",
    "body": "Due in 256 days (2/7/2026)",
    "scheduledTime": "2026-02-07T15:00:00.000Z",
    "repeat": "none",
    "createdAt": 1748443361700,
    "data": {}
  },
  {
    "id": "bd89f63847fd0f978c2fbee9",
    "title": "Reminder: Aadarsh's Bday",
    "body": "Due in 274 days (2/25/2026)",
    "scheduledTime": "2026-02-25T15:00:00.000Z",
    "repeat": "none",
    "createdAt": 1748443361700,
    "data": {}
  },
  {
    "id": "cb87e2d1cbfffdee7f7691d2",
    "title": "Reminder: Ethan Hoang's Bday",
    "body": "Due in 278 days (3/1/2026)",
    "scheduledTime": "2026-03-01T15:00:00.000Z",
    "repeat": "none",
    "createdAt": 1748443361701,
    "data": {}
  },
  {
    "id": "0ff6159189577b596bc1f1fc",
    "title": "Reminder: Tracie's Bday",
    "body": "Due in 310 days (4/3/2026)",
    "scheduledTime": "2026-04-03T14:00:00.000Z",
    "repeat": "none",
    "createdAt": 1748443361701,
    "data": {}
  },
  {
    "id": "df629a4ffe2c720256caffca",
    "title": "Reminder: Robert Herrerahs Bday",
    "body": "Due in 7 days (6/4/2025)",
    "scheduledTime": "2025-06-03T14:00:00.000Z",
    "repeat": "none",
    "createdAt": 1748443361701,
    "data": {}
  },
  {
    "id": "1d738659fa36dcf92e685cd7",
    "title": "Reminder: Calina's Bday",
    "body": "Due in 124 days (9/29/2025)",
    "scheduledTime": "2025-09-28T14:00:00.000Z",
    "repeat": "none",
    "createdAt": 1748443361702,
    "data": {}
  },
  {
    "id": "c90b5e04162cbee981483d20",
    "title": "Reminder: Update your christmas list and send it to people especially Kayla",
    "body": "Due in 198 days (12/11/2025)",
    "scheduledTime": "2025-12-11T15:00:00.000Z",
    "repeat": "none",
    "createdAt": 1748443361702,
    "data": {}
  },
  {
    "id": "d7d9dbc834c9cf40b99bd31f",
    "title": "Reminder: Oscar's Bday",
    "body": "Due in 16 days (6/13/2025)",
    "scheduledTime": "2025-06-12T14:00:00.000Z",
    "repeat": "none",
    "createdAt": 1748443361702,
    "data": {}
  },
  {
    "id": "681d484b5c3489167172d070",
    "title": "Reminder: Shelly's Bday",
    "body": "Due in 161 days (11/4/2025)",
    "scheduledTime": "2025-11-03T15:00:00.000Z",
    "repeat": "none",
    "createdAt": 1748443361703,
    "data": {}
  },
  {
    "id": "cb10734a08070466302b4a56",
    "title": "Reminder: Neil's Bday",
    "body": "Due in 262 days (2/13/2026)",
    "scheduledTime": "2026-02-13T15:00:00.000Z",
    "repeat": "none",
    "createdAt": 1748443361703,
    "data": {}
  },
  {
    "id": "c00da6cf1ff8f044cf5d596e",
    "title": "Reminder: Connor Pham's Bday",
    "body": "Due in 29 days (6/26/2025)",
    "scheduledTime": "2025-06-26T14:00:00.000Z",
    "repeat": "none",
    "createdAt": 1748480108346,
    "data": {}
  },
  {
    "id": "5568e0ab7578542ee0d6195d",
    "title": "Reminder: Alvin Matthew's Bday",
    "body": "Due in 29 days (6/26/2025)",
    "scheduledTime": "2025-06-26T14:00:00.000Z",
    "repeat": "none",
    "createdAt": 1748480108347,
    "data": {}
  },
  {
    "id": "6a19b86296229a15b6ed799e",
    "title": "Reminder: Pacey's Bday",
    "body": "Due in 59 days (7/26/2025)",
    "scheduledTime": "2025-07-26T14:00:00.000Z",
    "repeat": "none",
    "createdAt": 1748480108348,
    "data": {}
  },
  {
    "id": "528d2a12c21ce80d412c70bd",
    "title": "Reminder: Van's Bday",
    "body": "Due in 81 days (8/17/2025)",
    "scheduledTime": "2025-08-16T14:00:00.000Z",
    "repeat": "none",
    "createdAt": 1748480108349,
    "data": {}
  },
  {
    "id": "ff5ccbbb51f55bbbd0141bc0",
    "title": "Reminder: Daniela's Bday",
    "body": "Due in 89 days (8/25/2025)",
    "scheduledTime": "2025-08-25T14:00:00.000Z",
    "repeat": "none",
    "createdAt": 1748480108349,
    "data": {}
  },
  {
    "id": "a4005e80bac1465883d9d5da",
    "title": "Reminder: Kevin's (me)  Bday !!!!",
    "body": "Due in 126 days (10/1/2025)",
    "scheduledTime": "2025-10-01T14:00:00.000Z",
    "repeat": "none",
    "createdAt": 1748480108349,
    "data": {}
  },
  {
    "id": "632e91c500351571b2e92ae2",
    "title": "Reminder: Ben Kim's Bday",
    "body": "Due in 172 days (11/15/2025)",
    "scheduledTime": "2025-11-15T15:00:00.000Z",
    "repeat": "none",
    "createdAt": 1748480108350,
    "data": {}
  },
  {
    "id": "38db9b7cf5c271549478ba8e",
    "title": "Reminder: Jennifer's Bday",
    "body": "Due in 172 days (11/15/2025)",
    "scheduledTime": "2025-11-15T15:00:00.000Z",
    "repeat": "none",
    "createdAt": 1748480108350,
    "data": {}
  },
  {
    "id": "90a2823418d0507d1411fb69",
    "title": "Reminder: Nick le Bday",
    "body": "Due in 175 days (11/18/2025)",
    "scheduledTime": "2025-11-18T15:00:00.000Z",
    "repeat": "none",
    "createdAt": 1748480108350,
    "data": {}
  },
  {
    "id": "b67de5b30a395d055a77b07c",
    "title": "Reminder: Sneha's Bday",
    "body": "Due in 189 days (12/2/2025)",
    "scheduledTime": "2025-12-01T15:00:00.000Z",
    "repeat": "none",
    "createdAt": 1748480108351,
    "data": {}
  },
  {
    "id": "48afa7e7cda61b0527f22268",
    "title": "Reminder: Ali Niaz's Bday",
    "body": "Due in 198 days (12/11/2025)",
    "scheduledTime": "2025-12-11T15:00:00.000Z",
    "repeat": "none",
    "createdAt": 1748480108351,
    "data": {}
  },
  {
    "id": "e47f926354f9f2de2ff473a2",
    "title": "Reminder: Kaden's Bday",
    "body": "Due in 201 days (12/14/2025)",
    "scheduledTime": "2025-12-14T15:00:00.000Z",
    "repeat": "none",
    "createdAt": 1748480108352,
    "data": {}
  },
  {
    "id": "356a972513630d26928b09a5",
    "title": "Reminder: Dan Do's Bday",
    "body": "Due in 221 days (1/3/2026)",
    "scheduledTime": "2026-01-03T15:00:00.000Z",
    "repeat": "none",
    "createdAt": 1748480108352,
    "data": {}
  },
  {
    "id": "68c08d59f9a95ce889c73e93",
    "title": "Reminder: Preston's Bday",
    "body": "Due in 222 days (1/4/2026)",
    "scheduledTime": "2026-01-04T15:00:00.000Z",
    "repeat": "none",
    "createdAt": 1748480108352,
    "data": {}
  },
  {
    "id": "d85ed600580f011fabb38128",
    "title": "Reminder: Jerin Binu's Bday",
    "body": "Due in 228 days (1/10/2026)",
    "scheduledTime": "2026-01-10T15:00:00.000Z",
    "repeat": "none",
    "createdAt": 1748480108353,
    "data": {}
  },
  {
    "id": "003257d8cbc8bfb1ff949065",
    "title": "Reminder: Sannidhi's Bday",
    "body": "Due in 244 days (1/26/2026)",
    "scheduledTime": "2026-01-26T15:00:00.000Z",
    "repeat": "none",
    "createdAt": 1748480108353,
    "data": {}
  },
  {
    "id": "176f7abcf197c1eeb2d84d26",
    "title": "Reminder: Jame's Bday",
    "body": "Due in 254 days (2/5/2026)",
    "scheduledTime": "2026-02-05T15:00:00.000Z",
    "repeat": "none",
    "createdAt": 1748480108354,
    "data": {}
  },
  {
    "id": "f48b0bcbba4055fb64e20cfc",
    "title": "Reminder: Bryan Nguyen's Bday",
    "body": "Due in 280 days (3/3/2026)",
    "scheduledTime": "2026-03-03T15:00:00.000Z",
    "repeat": "none",
    "createdAt": 1748480108354,
    "data": {}
  },
  {
    "id": "83aff090a4194d1cdc689264",
    "title": "Reminder: Father's Day",
    "body": "Due in 17 days (6/14/2025)",
    "scheduledTime": "2025-06-13T14:00:00.000Z",
    "repeat": "none",
    "createdAt": 1748480108354,
    "data": {}
  },
  {
    "id": "553da8f53c5de62009a0736a",
    "title": "Reminder: Lucas Chan's Bday",
    "body": "Due in 247 days (1/29/2026)",
    "scheduledTime": "2026-01-29T15:00:00.000Z",
    "repeat": "none",
    "createdAt": 1748480108355,
    "data": {}
  },
  {
    "id": "189c83baf0c09f434ccfef59",
    "title": "Reminder: Mom's Bday",
    "body": "Due in 275 days (2/26/2026)",
    "scheduledTime": "2026-02-26T15:00:00.000Z",
    "repeat": "none",
    "createdAt": 1748480108355,
    "data": {}
  },
  {
    "id": "d3fb060eb37afe34b1b8fac2",
    "title": "Reminder: Evan's (Cousin) Bday",
    "body": "Due in 59 days (7/26/2025)",
    "scheduledTime": "2025-07-26T14:00:00.000Z",
    "repeat": "none",
    "createdAt": 1748480108355,
    "data": {}
  },
  {
    "id": "dcd491ad5cafec8484fb3ed0",
    "title": "Reminder: Om's Bday",
    "body": "Due in 43 days (7/10/2025)",
    "scheduledTime": "2025-07-10T14:00:00.000Z",
    "repeat": "none",
    "createdAt": 1748480108356,
    "data": {}
  },
  {
    "id": "3a9bc6647d3131f70530f620",
    "title": "Reminder: Anthony Nguyen's Bday",
    "body": "Due in 59 days (7/26/2025)",
    "scheduledTime": "2025-07-26T14:00:00.000Z",
    "repeat": "none",
    "createdAt": 1748480108356,
    "data": {}
  },
  {
    "id": "2bb2db257db1f5e0a59618e4",
    "title": "Reminder: Dad's Bday",
    "body": "Due in 84 days (8/20/2025)",
    "scheduledTime": "2025-08-19T14:00:00.000Z",
    "repeat": "none",
    "createdAt": 1748480108356,
    "data": {}
  },
  {
    "id": "85f8ccb7c1f067c28575eaaf",
    "title": "Reminder: Jason Hammdon's Bday",
    "body": "Due in 173 days (11/16/2025)",
    "scheduledTime": "2025-11-15T15:00:00.000Z",
    "repeat": "none",
    "createdAt": 1748480108357,
    "data": {}
  },
  {
    "id": "fb3681d510c9bfeaad487471",
    "title": "Reminder: Cancel Isaca Membership",
    "body": "Due in 95 days (8/31/2025)",
    "scheduledTime": "2025-08-31T14:00:00.000Z",
    "repeat": "none",
    "createdAt": 1748480108357,
    "data": {}
  },
  {
    "id": "3d2a90c5cc0cfae8709f02d5",
    "title": "Reminder: Pierson's Bday",
    "body": "Due in 179 days (11/22/2025)",
    "scheduledTime": "2025-11-22T15:00:00.000Z",
    "repeat": "none",
    "createdAt": 1748480108358,
    "data": {}
  },
  {
    "id": "4b9cb7603e57b1f8cc8c40e8",
    "title": "Reminder: Emiry's Bday",
    "body": "Due in 19 days (6/16/2025)",
    "scheduledTime": "2025-06-15T14:00:00.000Z",
    "repeat": "none",
    "createdAt": 1748480108358,
    "data": {}
  },
  {
    "id": "d7cac04c48712b3ea6fca80e",
    "title": "Reminder: Hogan Nguyen's Bday",
    "body": "Due in 275 days (2/26/2026)",
    "scheduledTime": "2026-02-26T15:00:00.000Z",
    "repeat": "none",
    "createdAt": 1748480108358,
    "data": {}
  },
  {
    "id": "e13b71fe05b7980b2de3530e",
    "title": "Reminder: Grace Ebbinghouse's Bday",
    "body": "Due in 42 days (7/9/2025)",
    "scheduledTime": "2025-07-09T14:00:00.000Z",
    "repeat": "none",
    "createdAt": 1748480108359,
    "data": {}
  },
  {
    "id": "369a23da699a4cad2ac1884f",
    "title": "Reminder: Mary's Bday",
    "body": "Due in 120 days (9/25/2025)",
    "scheduledTime": "2025-09-24T14:00:00.000Z",
    "repeat": "none",
    "createdAt": 1748480108359,
    "data": {}
  },
  {
    "id": "c805843b4b9859dff807d033",
    "title": "Reminder: Karans Bday",
    "body": "Due in 16 days (6/13/2025)",
    "scheduledTime": "2025-06-12T14:00:00.000Z",
    "repeat": "none",
    "createdAt": 1748480108360,
    "data": {}
  },
  {
    "id": "b2bab34500fa771e3c953216",
    "title": "Reminder: Hannah Wee's Bday",
    "body": "Due in 22 days (6/19/2025)",
    "scheduledTime": "2025-06-19T14:00:00.000Z",
    "repeat": "none",
    "createdAt": 1748480108360,
    "data": {}
  },
  {
    "id": "d0400d586b11a53cffaf4222",
    "title": "Reminder: Cancel your yearly microsoft 365 subscription",
    "body": "Due in 83 days (8/19/2025)",
    "scheduledTime": "2025-08-19T14:00:00.000Z",
    "repeat": "none",
    "createdAt": 1748480108361,
    "data": {}
  },
  {
    "id": "9c7bbc02cc4665574fc711e3",
    "title": "Reminder: Brandon Sanchez's Bday",
    "body": "Due in 22 days (6/19/2025)",
    "scheduledTime": "2025-06-19T14:00:00.000Z",
    "repeat": "none",
    "createdAt": 1748480108361,
    "data": {}
  },
  {
    "id": "c18e5d71a4745118fd1f2ad0",
    "title": "Reminder: Tyler Requa's Bday",
    "body": "Due in 52 days (7/19/2025)",
    "scheduledTime": "2025-07-19T14:00:00.000Z",
    "repeat": "none",
    "createdAt": 1748480108361,
    "data": {}
  },
  {
    "id": "a648b8bd20ec7eb83f9b11f8",
    "title": "Reminder: National GF Day",
    "body": "Due in 64 days (7/31/2025)",
    "scheduledTime": "2025-07-30T14:00:00.000Z",
    "repeat": "none",
    "createdAt": 1748480108362,
    "data": {}
  },
  {
    "id": "966491795f97c012fdaf675a",
    "title": "Reminder: Brandon (Nigel) Bday",
    "body": "Due in 169 days (11/12/2025)",
    "scheduledTime": "2025-11-11T15:00:00.000Z",
    "repeat": "none",
    "createdAt": 1748480108362,
    "data": {}
  },
  {
    "id": "b3ccb86f80892857134e46b8",
    "title": "Reminder: Paxton's Bday",
    "body": "Due in 174 days (11/17/2025)",
    "scheduledTime": "2025-11-16T15:00:00.000Z",
    "repeat": "none",
    "createdAt": 1748480108362,
    "data": {}
  },
  {
    "id": "86645f5f6aa9e1bf977013a4",
    "title": "Reminder: David's Bday",
    "body": "Due in 174 days (11/17/2025)",
    "scheduledTime": "2025-11-16T15:00:00.000Z",
    "repeat": "none",
    "createdAt": 1748480108363,
    "data": {}
  },
  {
    "id": "209f61b4fe20a56956ddce2a",
    "title": "Reminder: Kyduyen's Bday",
    "body": "Due in 183 days (11/26/2025)",
    "scheduledTime": "2025-11-25T15:00:00.000Z",
    "repeat": "none",
    "createdAt": 1748480108363,
    "data": {}
  },
  {
    "id": "0794dbfcf2c9d66f06f87fe8",
    "title": "Reminder: Kai Fernando's Bday",
    "body": "Due in 189 days (12/2/2025)",
    "scheduledTime": "2025-12-02T15:00:00.000Z",
    "repeat": "none",
    "createdAt": 1748480108363,
    "data": {}
  },
  {
    "id": "78c45dc0808d1f661c24baf5",
    "title": "Reminder: Cooper's Bday",
    "body": "Due in 215 days (12/28/2025)",
    "scheduledTime": "2025-12-28T15:00:00.000Z",
    "repeat": "none",
    "createdAt": 1748480108364,
    "data": {}
  },
  {
    "id": "073789d8e0c5a7c157f2b01a",
    "title": "Reminder: Andre Sae's Bday",
    "body": "Due in 237 days (1/19/2026)",
    "scheduledTime": "2026-01-19T15:00:00.000Z",
    "repeat": "none",
    "createdAt": 1748480108364,
    "data": {}
  },
  {
    "id": "54e4d58b41cf2e39b4a56528",
    "title": "Reminder: Kayla's Bday",
    "body": "Due in 249 days (1/31/2026)",
    "scheduledTime": "2026-01-31T15:00:00.000Z",
    "repeat": "none",
    "createdAt": 1748480108364,
    "data": {}
  },
  {
    "id": "76cf453c2749f223f05bcbd1",
    "title": "Reminder: Rafael's Bday",
    "body": "Due in 256 days (2/7/2026)",
    "scheduledTime": "2026-02-07T15:00:00.000Z",
    "repeat": "none",
    "createdAt": 1748480108365,
    "data": {}
  },
  {
    "id": "3f893c0b3e105089a925b351",
    "title": "Reminder: Aadarsh's Bday",
    "body": "Due in 274 days (2/25/2026)",
    "scheduledTime": "2026-02-25T15:00:00.000Z",
    "repeat": "none",
    "createdAt": 1748480108365,
    "data": {}
  },
  {
    "id": "5c832c3c26a8a59c19ca79a6",
    "title": "Reminder: Ethan Hoang's Bday",
    "body": "Due in 278 days (3/1/2026)",
    "scheduledTime": "2026-03-01T15:00:00.000Z",
    "repeat": "none",
    "createdAt": 1748480108365,
    "data": {}
  },
  {
    "id": "a54f0dbd27eb467154b0d0f3",
    "title": "Reminder: Tracie's Bday",
    "body": "Due in 310 days (4/3/2026)",
    "scheduledTime": "2026-04-03T14:00:00.000Z",
    "repeat": "none",
    "createdAt": 1748480108366,
    "data": {}
  },
  {
    "id": "90e0318a095b255d7d40525a",
    "title": "Reminder: Robert Herrerahs Bday",
    "body": "Due in 7 days (6/4/2025)",
    "scheduledTime": "2025-06-03T14:00:00.000Z",
    "repeat": "none",
    "createdAt": 1748480108366,
    "data": {}
  },
  {
    "id": "3cdffc739f34777b51133f7e",
    "title": "Reminder: Calina's Bday",
    "body": "Due in 124 days (9/29/2025)",
    "scheduledTime": "2025-09-28T14:00:00.000Z",
    "repeat": "none",
    "createdAt": 1748480108366,
    "data": {}
  },
  {
    "id": "c48494b3032eb7085754dc55",
    "title": "Reminder: Update your christmas list and send it to people especially Kayla",
    "body": "Due in 198 days (12/11/2025)",
    "scheduledTime": "2025-12-11T15:00:00.000Z",
    "repeat": "none",
    "createdAt": 1748480108367,
    "data": {}
  },
  {
    "id": "8e81f2647fa7fd49687517fb",
    "title": "Reminder: Oscar's Bday",
    "body": "Due in 16 days (6/13/2025)",
    "scheduledTime": "2025-06-12T14:00:00.000Z",
    "repeat": "none",
    "createdAt": 1748480108367,
    "data": {}
  },
  {
    "id": "d4d59899200064991f418efc",
    "title": "Reminder: Shelly's Bday",
    "body": "Due in 161 days (11/4/2025)",
    "scheduledTime": "2025-11-03T15:00:00.000Z",
    "repeat": "none",
    "createdAt": 1748480108367,
    "data": {}
  },
  {
    "id": "bc30954dad50b0be1079b8b2",
    "title": "Reminder: Neil's Bday",
    "body": "Due in 262 days (2/13/2026)",
    "scheduledTime": "2026-02-13T15:00:00.000Z",
    "repeat": "none",
    "createdAt": 1748480108368,
    "data": {}
  },
  {
    "id": "1c1c3808c4ee1ece1fd01fae",
    "title": "Reminder: Connor Pham's Bday",
    "body": "Due in 29 days (6/26/2025)",
    "scheduledTime": "2025-06-26T14:00:00.000Z",
    "repeat": "none",
    "createdAt": 1748480975383,
    "data": {}
  },
  {
    "id": "c97fe4d42d2ddfa8bb9081c2",
    "title": "Reminder: Alvin Matthew's Bday",
    "body": "Due in 29 days (6/26/2025)",
    "scheduledTime": "2025-06-26T14:00:00.000Z",
    "repeat": "none",
    "createdAt": 1748480975384,
    "data": {}
  },
  {
    "id": "6b238f6891a10f5d6bec7a08",
    "title": "Reminder: Pacey's Bday",
    "body": "Due in 59 days (7/26/2025)",
    "scheduledTime": "2025-07-26T14:00:00.000Z",
    "repeat": "none",
    "createdAt": 1748480975384,
    "data": {}
  },
  {
    "id": "8298a7a6f4aff037c2f5ec63",
    "title": "Reminder: Van's Bday",
    "body": "Due in 81 days (8/17/2025)",
    "scheduledTime": "2025-08-16T14:00:00.000Z",
    "repeat": "none",
    "createdAt": 1748480975385,
    "data": {}
  },
  {
    "id": "7b55b9e460866a7d03f39137",
    "title": "Reminder: Daniela's Bday",
    "body": "Due in 89 days (8/25/2025)",
    "scheduledTime": "2025-08-25T14:00:00.000Z",
    "repeat": "none",
    "createdAt": 1748480975385,
    "data": {}
  },
  {
    "id": "185b8b6b268172ab9ed118bc",
    "title": "Reminder: Kevin's (me)  Bday !!!!",
    "body": "Due in 126 days (10/1/2025)",
    "scheduledTime": "2025-10-01T14:00:00.000Z",
    "repeat": "none",
    "createdAt": 1748480975385,
    "data": {}
  },
  {
    "id": "caea44bc75a062579db6c959",
    "title": "Reminder: Ben Kim's Bday",
    "body": "Due in 172 days (11/15/2025)",
    "scheduledTime": "2025-11-15T15:00:00.000Z",
    "repeat": "none",
    "createdAt": 1748480975386,
    "data": {}
  },
  {
    "id": "89ed38f585497cd479e8cfd6",
    "title": "Reminder: Jennifer's Bday",
    "body": "Due in 172 days (11/15/2025)",
    "scheduledTime": "2025-11-15T15:00:00.000Z",
    "repeat": "none",
    "createdAt": 1748480975386,
    "data": {}
  },
  {
    "id": "a60501fe00850645856dcafe",
    "title": "Reminder: Nick le Bday",
    "body": "Due in 175 days (11/18/2025)",
    "scheduledTime": "2025-11-18T15:00:00.000Z",
    "repeat": "none",
    "createdAt": 1748480975387,
    "data": {}
  },
  {
    "id": "4e6486024bc109b69a65682f",
    "title": "Reminder: Sneha's Bday",
    "body": "Due in 189 days (12/2/2025)",
    "scheduledTime": "2025-12-01T15:00:00.000Z",
    "repeat": "none",
    "createdAt": 1748480975388,
    "data": {}
  },
  {
    "id": "448d499d354829fbdf4c4390",
    "title": "Reminder: Ali Niaz's Bday",
    "body": "Due in 198 days (12/11/2025)",
    "scheduledTime": "2025-12-11T15:00:00.000Z",
    "repeat": "none",
    "createdAt": 1748480975388,
    "data": {}
  },
  {
    "id": "bdb4ee5b34bc210fba50fe95",
    "title": "Reminder: Kaden's Bday",
    "body": "Due in 201 days (12/14/2025)",
    "scheduledTime": "2025-12-14T15:00:00.000Z",
    "repeat": "none",
    "createdAt": 1748480975389,
    "data": {}
  },
  {
    "id": "04320c76cc782334367e2a30",
    "title": "Reminder: Dan Do's Bday",
    "body": "Due in 221 days (1/3/2026)",
    "scheduledTime": "2026-01-03T15:00:00.000Z",
    "repeat": "none",
    "createdAt": 1748480975389,
    "data": {}
  },
  {
    "id": "14287a4660534abefb055285",
    "title": "Reminder: Preston's Bday",
    "body": "Due in 222 days (1/4/2026)",
    "scheduledTime": "2026-01-04T15:00:00.000Z",
    "repeat": "none",
    "createdAt": 1748480975390,
    "data": {}
  },
  {
    "id": "ad672f6d66a4d510b09a12d9",
    "title": "Reminder: Jerin Binu's Bday",
    "body": "Due in 228 days (1/10/2026)",
    "scheduledTime": "2026-01-10T15:00:00.000Z",
    "repeat": "none",
    "createdAt": 1748480975390,
    "data": {}
  },
  {
    "id": "3615ff31498809a6dccfe4d5",
    "title": "Reminder: Sannidhi's Bday",
    "body": "Due in 244 days (1/26/2026)",
    "scheduledTime": "2026-01-26T15:00:00.000Z",
    "repeat": "none",
    "createdAt": 1748480975392,
    "data": {}
  },
  {
    "id": "875206e692c1acd7f36addf5",
    "title": "Reminder: Jame's Bday",
    "body": "Due in 254 days (2/5/2026)",
    "scheduledTime": "2026-02-05T15:00:00.000Z",
    "repeat": "none",
    "createdAt": 1748480975392,
    "data": {}
  },
  {
    "id": "0f8f0f9fd2702347b84cc303",
    "title": "Reminder: Bryan Nguyen's Bday",
    "body": "Due in 280 days (3/3/2026)",
    "scheduledTime": "2026-03-03T15:00:00.000Z",
    "repeat": "none",
    "createdAt": 1748480975393,
    "data": {}
  },
  {
    "id": "472f3a71748e6ced334d1690",
    "title": "Reminder: Father's Day",
    "body": "Due in 17 days (6/14/2025)",
    "scheduledTime": "2025-06-13T14:00:00.000Z",
    "repeat": "none",
    "createdAt": 1748480975394,
    "data": {}
  },
  {
    "id": "1ee197aa8ae65d372ee4f6d7",
    "title": "Reminder: Lucas Chan's Bday",
    "body": "Due in 247 days (1/29/2026)",
    "scheduledTime": "2026-01-29T15:00:00.000Z",
    "repeat": "none",
    "createdAt": 1748480975394,
    "data": {}
  },
  {
    "id": "69c6dc1efc0a0a4e6e9480db",
    "title": "Reminder: Mom's Bday",
    "body": "Due in 275 days (2/26/2026)",
    "scheduledTime": "2026-02-26T15:00:00.000Z",
    "repeat": "none",
    "createdAt": 1748480975394,
    "data": {}
  },
  {
    "id": "67a192a45e6f386e5eb08194",
    "title": "Reminder: Evan's (Cousin) Bday",
    "body": "Due in 59 days (7/26/2025)",
    "scheduledTime": "2025-07-26T14:00:00.000Z",
    "repeat": "none",
    "createdAt": 1748480975395,
    "data": {}
  },
  {
    "id": "dd96fcfabcca84fed744263f",
    "title": "Reminder: Om's Bday",
    "body": "Due in 43 days (7/10/2025)",
    "scheduledTime": "2025-07-10T14:00:00.000Z",
    "repeat": "none",
    "createdAt": 1748480975395,
    "data": {}
  },
  {
    "id": "fe4852bc030d06acdb15307c",
    "title": "Reminder: Anthony Nguyen's Bday",
    "body": "Due in 59 days (7/26/2025)",
    "scheduledTime": "2025-07-26T14:00:00.000Z",
    "repeat": "none",
    "createdAt": 1748480975396,
    "data": {}
  },
  {
    "id": "04587010530a0103094bbb46",
    "title": "Reminder: Dad's Bday",
    "body": "Due in 84 days (8/20/2025)",
    "scheduledTime": "2025-08-19T14:00:00.000Z",
    "repeat": "none",
    "createdAt": 1748480975396,
    "data": {}
  },
  {
    "id": "1cb36a5da7c53786506e603e",
    "title": "Reminder: Jason Hammdon's Bday",
    "body": "Due in 173 days (11/16/2025)",
    "scheduledTime": "2025-11-15T15:00:00.000Z",
    "repeat": "none",
    "createdAt": 1748480975396,
    "data": {}
  },
  {
    "id": "36a96aeff3b8ad5a171ab8e4",
    "title": "Reminder: Cancel Isaca Membership",
    "body": "Due in 95 days (8/31/2025)",
    "scheduledTime": "2025-08-31T14:00:00.000Z",
    "repeat": "none",
    "createdAt": 1748480975397,
    "data": {}
  },
  {
    "id": "3c3fa6ddaaf668040391287e",
    "title": "Reminder: Pierson's Bday",
    "body": "Due in 179 days (11/22/2025)",
    "scheduledTime": "2025-11-22T15:00:00.000Z",
    "repeat": "none",
    "createdAt": 1748480975397,
    "data": {}
  },
  {
    "id": "feab067f14d488a9d68dfc9d",
    "title": "Reminder: Emiry's Bday",
    "body": "Due in 19 days (6/16/2025)",
    "scheduledTime": "2025-06-15T14:00:00.000Z",
    "repeat": "none",
    "createdAt": 1748480975398,
    "data": {}
  },
  {
    "id": "213ebe9c8615c277eefaa71f",
    "title": "Reminder: Hogan Nguyen's Bday",
    "body": "Due in 275 days (2/26/2026)",
    "scheduledTime": "2026-02-26T15:00:00.000Z",
    "repeat": "none",
    "createdAt": 1748480975398,
    "data": {}
  },
  {
    "id": "6209a5f5dbfd3e095a8daae7",
    "title": "Reminder: Grace Ebbinghouse's Bday",
    "body": "Due in 42 days (7/9/2025)",
    "scheduledTime": "2025-07-09T14:00:00.000Z",
    "repeat": "none",
    "createdAt": 1748480975398,
    "data": {}
  },
  {
    "id": "a428a508a27dfc1548b3b0fc",
    "title": "Reminder: Mary's Bday",
    "body": "Due in 120 days (9/25/2025)",
    "scheduledTime": "2025-09-24T14:00:00.000Z",
    "repeat": "none",
    "createdAt": 1748480975399,
    "data": {}
  },
  {
    "id": "9f6c01275167ccba597b57dc",
    "title": "Reminder: Karans Bday",
    "body": "Due in 16 days (6/13/2025)",
    "scheduledTime": "2025-06-12T14:00:00.000Z",
    "repeat": "none",
    "createdAt": 1748480975399,
    "data": {}
  },
  {
    "id": "f2624cd71f67384c78bf12bc",
    "title": "Reminder: Hannah Wee's Bday",
    "body": "Due in 22 days (6/19/2025)",
    "scheduledTime": "2025-06-19T14:00:00.000Z",
    "repeat": "none",
    "createdAt": 1748480975400,
    "data": {}
  },
  {
    "id": "e72cece00f275fb9ca0ba98f",
    "title": "Reminder: Cancel your yearly microsoft 365 subscription",
    "body": "Due in 83 days (8/19/2025)",
    "scheduledTime": "2025-08-19T14:00:00.000Z",
    "repeat": "none",
    "createdAt": 1748480975400,
    "data": {}
  },
  {
    "id": "1e6ddef0130d3e60135745c9",
    "title": "Reminder: Brandon Sanchez's Bday",
    "body": "Due in 22 days (6/19/2025)",
    "scheduledTime": "2025-06-19T14:00:00.000Z",
    "repeat": "none",
    "createdAt": 1748480975401,
    "data": {}
  },
  {
    "id": "e5e791a3fca6ce993f6bc0ee",
    "title": "Reminder: Tyler Requa's Bday",
    "body": "Due in 52 days (7/19/2025)",
    "scheduledTime": "2025-07-19T14:00:00.000Z",
    "repeat": "none",
    "createdAt": 1748480975401,
    "data": {}
  },
  {
    "id": "4da9cf8247798af299e02415",
    "title": "Reminder: National GF Day",
    "body": "Due in 64 days (7/31/2025)",
    "scheduledTime": "2025-07-30T14:00:00.000Z",
    "repeat": "none",
    "createdAt": 1748480975401,
    "data": {}
  },
  {
    "id": "9b9b111e3007dc46a184d773",
    "title": "Reminder: Brandon (Nigel) Bday",
    "body": "Due in 169 days (11/12/2025)",
    "scheduledTime": "2025-11-11T15:00:00.000Z",
    "repeat": "none",
    "createdAt": 1748480975402,
    "data": {}
  },
  {
    "id": "8f7166dfc3b9fed9f5141f7d",
    "title": "Reminder: Paxton's Bday",
    "body": "Due in 174 days (11/17/2025)",
    "scheduledTime": "2025-11-16T15:00:00.000Z",
    "repeat": "none",
    "createdAt": 1748480975402,
    "data": {}
  },
  {
    "id": "999205eaacba7ec5705b5f64",
    "title": "Reminder: David's Bday",
    "body": "Due in 174 days (11/17/2025)",
    "scheduledTime": "2025-11-16T15:00:00.000Z",
    "repeat": "none",
    "createdAt": 1748480975403,
    "data": {}
  },
  {
    "id": "60bfbbfcc00e5610d3f65ec2",
    "title": "Reminder: Kyduyen's Bday",
    "body": "Due in 183 days (11/26/2025)",
    "scheduledTime": "2025-11-25T15:00:00.000Z",
    "repeat": "none",
    "createdAt": 1748480975403,
    "data": {}
  },
  {
    "id": "d0c54b4f64cdfc86f75cefc5",
    "title": "Reminder: Kai Fernando's Bday",
    "body": "Due in 189 days (12/2/2025)",
    "scheduledTime": "2025-12-02T15:00:00.000Z",
    "repeat": "none",
    "createdAt": 1748480975404,
    "data": {}
  },
  {
    "id": "6ea0b22b2643f6fe7128291b",
    "title": "Reminder: Cooper's Bday",
    "body": "Due in 215 days (12/28/2025)",
    "scheduledTime": "2025-12-28T15:00:00.000Z",
    "repeat": "none",
    "createdAt": 1748480975404,
    "data": {}
  },
  {
    "id": "a58c97a3c932063f1117a944",
    "title": "Reminder: Andre Sae's Bday",
    "body": "Due in 237 days (1/19/2026)",
    "scheduledTime": "2026-01-19T15:00:00.000Z",
    "repeat": "none",
    "createdAt": 1748480975405,
    "data": {}
  },
  {
    "id": "47992c39780c14b9291b98e3",
    "title": "Reminder: Kayla's Bday",
    "body": "Due in 249 days (1/31/2026)",
    "scheduledTime": "2026-01-31T15:00:00.000Z",
    "repeat": "none",
    "createdAt": 1748480975405,
    "data": {}
  },
  {
    "id": "16c46e39ab30c0bfe500078f",
    "title": "Reminder: Rafael's Bday",
    "body": "Due in 256 days (2/7/2026)",
    "scheduledTime": "2026-02-07T15:00:00.000Z",
    "repeat": "none",
    "createdAt": 1748480975406,
    "data": {}
  },
  {
    "id": "a23cc456a80dc568f0f228ae",
    "title": "Reminder: Aadarsh's Bday",
    "body": "Due in 274 days (2/25/2026)",
    "scheduledTime": "2026-02-25T15:00:00.000Z",
    "repeat": "none",
    "createdAt": 1748480975407,
    "data": {}
  },
  {
    "id": "a166e4c707c076b6cc465c7e",
    "title": "Reminder: Ethan Hoang's Bday",
    "body": "Due in 278 days (3/1/2026)",
    "scheduledTime": "2026-03-01T15:00:00.000Z",
    "repeat": "none",
    "createdAt": 1748480975407,
    "data": {}
  },
  {
    "id": "c85dcbe3dbbdfc0f806e6b37",
    "title": "Reminder: Tracie's Bday",
    "body": "Due in 310 days (4/3/2026)",
    "scheduledTime": "2026-04-03T14:00:00.000Z",
    "repeat": "none",
    "createdAt": 1748480975407,
    "data": {}
  },
  {
    "id": "c4ab31a421a977914cc2f2a1",
    "title": "Reminder: Robert Herrerahs Bday",
    "body": "Due in 7 days (6/4/2025)",
    "scheduledTime": "2025-06-03T14:00:00.000Z",
    "repeat": "none",
    "createdAt": 1748480975408,
    "data": {}
  },
  {
    "id": "367b612e9426c5cdfcc7ed01",
    "title": "Reminder: Calina's Bday",
    "body": "Due in 124 days (9/29/2025)",
    "scheduledTime": "2025-09-28T14:00:00.000Z",
    "repeat": "none",
    "createdAt": 1748480975409,
    "data": {}
  },
  {
    "id": "920f7b81cbb13343b1c2e81c",
    "title": "Reminder: Update your christmas list and send it to people especially Kayla",
    "body": "Due in 198 days (12/11/2025)",
    "scheduledTime": "2025-12-11T15:00:00.000Z",
    "repeat": "none",
    "createdAt": 1748480975409,
    "data": {}
  },
  {
    "id": "137fe53b41623797fea90de8",
    "title": "Reminder: Oscar's Bday",
    "body": "Due in 16 days (6/13/2025)",
    "scheduledTime": "2025-06-12T14:00:00.000Z",
    "repeat": "none",
    "createdAt": 1748480975409,
    "data": {}
  },
  {
    "id": "e011526d7a6702c882453219",
    "title": "Reminder: Shelly's Bday",
    "body": "Due in 161 days (11/4/2025)",
    "scheduledTime": "2025-11-03T15:00:00.000Z",
    "repeat": "none",
    "createdAt": 1748480975410,
    "data": {}
  },
  {
    "id": "fde1037b34b478d853db7ba5",
    "title": "Reminder: Neil's Bday",
    "body": "Due in 262 days (2/13/2026)",
    "scheduledTime": "2026-02-13T15:00:00.000Z",
    "repeat": "none",
    "createdAt": 1748480975410,
    "data": {}
  },
  {
    "id": "f67f2a8c0a639889550a841f",
    "title": " Overdue Reminder: Reminder test notifs",
    "body": "Reminder was 2 days overdue - Due 5/27/2025",
    "scheduledTime": "2025-05-29T14:46:25.705Z",
    "repeat": "none",
    "createdAt": 1748529985706,
    "data": {}
  },
  {
    "id": "b42c704d337e72dd51c27a35",
    "title": "Reminder: Connor Pham's Bday",
    "body": "Due in 28 days (6/26/2025)",
    "scheduledTime": "2025-06-26T14:00:00.000Z",
    "repeat": "none",
    "createdAt": 1748541172499,
    "data": {}
  },
  {
    "id": "9130b104aac257ccaf08a70b",
    "title": "Reminder: Alvin Matthew's Bday",
    "body": "Due in 28 days (6/26/2025)",
    "scheduledTime": "2025-06-26T14:00:00.000Z",
    "repeat": "none",
    "createdAt": 1748541172506,
    "data": {}
  },
  {
    "id": "266b9d2b04319b404aad2cef",
    "title": "Reminder: Pacey's Bday",
    "body": "Due in 58 days (7/26/2025)",
    "scheduledTime": "2025-07-26T14:00:00.000Z",
    "repeat": "none",
    "createdAt": 1748541172516,
    "data": {}
  },
  {
    "id": "701b3b29473853d25ac75073",
    "title": "Reminder: Van's Bday",
    "body": "Due in 80 days (8/17/2025)",
    "scheduledTime": "2025-08-16T14:00:00.000Z",
    "repeat": "none",
    "createdAt": 1748541172521,
    "data": {}
  },
  {
    "id": "662bb5e2795813b75ff05293",
    "title": "Reminder: Daniela's Bday",
    "body": "Due in 88 days (8/25/2025)",
    "scheduledTime": "2025-08-25T14:00:00.000Z",
    "repeat": "none",
    "createdAt": 1748541172524,
    "data": {}
  },
  {
    "id": "0cd8836cb7370ddd72c5e6f4",
    "title": "Reminder: Kevin's (me)  Bday !!!!",
    "body": "Due in 125 days (10/1/2025)",
    "scheduledTime": "2025-10-01T14:00:00.000Z",
    "repeat": "none",
    "createdAt": 1748541172529,
    "data": {}
  },
  {
    "id": "817cce70e58d6a3bff4f00ac",
    "title": "Reminder: Ben Kim's Bday",
    "body": "Due in 171 days (11/15/2025)",
    "scheduledTime": "2025-11-15T15:00:00.000Z",
    "repeat": "none",
    "createdAt": 1748541172531,
    "data": {}
  },
  {
    "id": "1230f3b1cdd5a30964db4483",
    "title": "Reminder: Jennifer's Bday",
    "body": "Due in 171 days (11/15/2025)",
    "scheduledTime": "2025-11-15T15:00:00.000Z",
    "repeat": "none",
    "createdAt": 1748541172534,
    "data": {}
  },
  {
    "id": "17fa62c008e562775e3b3cb6",
    "title": "Reminder: Nick le Bday",
    "body": "Due in 174 days (11/18/2025)",
    "scheduledTime": "2025-11-18T15:00:00.000Z",
    "repeat": "none",
    "createdAt": 1748541172537,
    "data": {}
  },
  {
    "id": "36bec7acc3aaf9c347ecf5c7",
    "title": "Reminder: Sneha's Bday",
    "body": "Due in 188 days (12/2/2025)",
    "scheduledTime": "2025-12-01T15:00:00.000Z",
    "repeat": "none",
    "createdAt": 1748541172540,
    "data": {}
  },
  {
    "id": "663344a918b79edae1f0d7d8",
    "title": "Reminder: Ali Niaz's Bday",
    "body": "Due in 197 days (12/11/2025)",
    "scheduledTime": "2025-12-11T15:00:00.000Z",
    "repeat": "none",
    "createdAt": 1748541172545,
    "data": {}
  },
  {
    "id": "2580d78a8085cc0ab1ed784f",
    "title": "Reminder: Kaden's Bday",
    "body": "Due in 200 days (12/14/2025)",
    "scheduledTime": "2025-12-14T15:00:00.000Z",
    "repeat": "none",
    "createdAt": 1748541172547,
    "data": {}
  },
  {
    "id": "6b37eccfbfefa001e6e85d6a",
    "title": "Reminder: Dan Do's Bday",
    "body": "Due in 220 days (1/3/2026)",
    "scheduledTime": "2026-01-03T15:00:00.000Z",
    "repeat": "none",
    "createdAt": 1748541172550,
    "data": {}
  },
  {
    "id": "6d5a07b53c42f342f2703f89",
    "title": "Reminder: Preston's Bday",
    "body": "Due in 221 days (1/4/2026)",
    "scheduledTime": "2026-01-04T15:00:00.000Z",
    "repeat": "none",
    "createdAt": 1748541172552,
    "data": {}
  },
  {
    "id": "cfa3c3b854083d7a9f38cc49",
    "title": "Reminder: Jerin Binu's Bday",
    "body": "Due in 227 days (1/10/2026)",
    "scheduledTime": "2026-01-10T15:00:00.000Z",
    "repeat": "none",
    "createdAt": 1748541172555,
    "data": {}
  },
  {
    "id": "c726756057b032055699e5ba",
    "title": "Reminder: Sannidhi's Bday",
    "body": "Due in 243 days (1/26/2026)",
    "scheduledTime": "2026-01-26T15:00:00.000Z",
    "repeat": "none",
    "createdAt": 1748541172562,
    "data": {}
  },
  {
    "id": "cd88ddbc12efca80118b2290",
    "title": "Reminder: Jame's Bday",
    "body": "Due in 253 days (2/5/2026)",
    "scheduledTime": "2026-02-05T15:00:00.000Z",
    "repeat": "none",
    "createdAt": 1748541172565,
    "data": {}
  },
  {
    "id": "76eaf32f123a9b8afa094b7e",
    "title": "Reminder: Bryan Nguyen's Bday",
    "body": "Due in 279 days (3/3/2026)",
    "scheduledTime": "2026-03-03T15:00:00.000Z",
    "repeat": "none",
    "createdAt": 1748541172568,
    "data": {}
  },
  {
    "id": "c3bd1fe21949e1eb2e59b2ad",
    "title": "Reminder: Father's Day",
    "body": "Due in 16 days (6/14/2025)",
    "scheduledTime": "2025-06-13T14:00:00.000Z",
    "repeat": "none",
    "createdAt": 1748541172571,
    "data": {}
  },
  {
    "id": "a0512fb3c3b1ec0fe3fd0656",
    "title": "Reminder: Lucas Chan's Bday",
    "body": "Due in 246 days (1/29/2026)",
    "scheduledTime": "2026-01-29T15:00:00.000Z",
    "repeat": "none",
    "createdAt": 1748541172573,
    "data": {}
  },
  {
    "id": "0664b3da51a37cd06d879b4d",
    "title": "Reminder: Mom's Bday",
    "body": "Due in 274 days (2/26/2026)",
    "scheduledTime": "2026-02-26T15:00:00.000Z",
    "repeat": "none",
    "createdAt": 1748541172578,
    "data": {}
  },
  {
    "id": "48499841d4cfb20599c1d4e0",
    "title": "Reminder: Evan's (Cousin) Bday",
    "body": "Due in 58 days (7/26/2025)",
    "scheduledTime": "2025-07-26T14:00:00.000Z",
    "repeat": "none",
    "createdAt": 1748541172581,
    "data": {}
  },
  {
    "id": "318172e1eed64c8df0ecca23",
    "title": "Reminder: Om's Bday",
    "body": "Due in 42 days (7/10/2025)",
    "scheduledTime": "2025-07-10T14:00:00.000Z",
    "repeat": "none",
    "createdAt": 1748541172584,
    "data": {}
  },
  {
    "id": "aaec88bf20fb6a5dbf0649eb",
    "title": "Reminder: Anthony Nguyen's Bday",
    "body": "Due in 58 days (7/26/2025)",
    "scheduledTime": "2025-07-26T14:00:00.000Z",
    "repeat": "none",
    "createdAt": 1748541172587,
    "data": {}
  },
  {
    "id": "0fd02b3426c0009a7f6a0fd0",
    "title": "Reminder: Dad's Bday",
    "body": "Due in 83 days (8/20/2025)",
    "scheduledTime": "2025-08-19T14:00:00.000Z",
    "repeat": "none",
    "createdAt": 1748541172589,
    "data": {}
  },
  {
    "id": "dc42a421604e98c568ec05a7",
    "title": "Reminder: Jason Hammdon's Bday",
    "body": "Due in 172 days (11/16/2025)",
    "scheduledTime": "2025-11-15T15:00:00.000Z",
    "repeat": "none",
    "createdAt": 1748541172595,
    "data": {}
  },
  {
    "id": "8e021ffd694fc0246e69a3b1",
    "title": "Reminder: Cancel Isaca Membership",
    "body": "Due in 94 days (8/31/2025)",
    "scheduledTime": "2025-08-31T14:00:00.000Z",
    "repeat": "none",
    "createdAt": 1748541172597,
    "data": {}
  },
  {
    "id": "ea52d4688cd45e379aa0c74a",
    "title": "Reminder: Pierson's Bday",
    "body": "Due in 178 days (11/22/2025)",
    "scheduledTime": "2025-11-22T15:00:00.000Z",
    "repeat": "none",
    "createdAt": 1748541172600,
    "data": {}
  },
  {
    "id": "0acd74c7584aba71af9b0754",
    "title": "Reminder: Emiry's Bday",
    "body": "Due in 18 days (6/16/2025)",
    "scheduledTime": "2025-06-15T14:00:00.000Z",
    "repeat": "none",
    "createdAt": 1748541172603,
    "data": {}
  },
  {
    "id": "6ae0eccb3f21ff1a4ceec27a",
    "title": "Reminder: Hogan Nguyen's Bday",
    "body": "Due in 274 days (2/26/2026)",
    "scheduledTime": "2026-02-26T15:00:00.000Z",
    "repeat": "none",
    "createdAt": 1748541172606,
    "data": {}
  },
  {
    "id": "8ac9fd5babd5ad31ef4bab7e",
    "title": "Reminder: Grace Ebbinghouse's Bday",
    "body": "Due in 41 days (7/9/2025)",
    "scheduledTime": "2025-07-09T14:00:00.000Z",
    "repeat": "none",
    "createdAt": 1748541172610,
    "data": {}
  },
  {
    "id": "29f51439ced7066197b2334f",
    "title": "Reminder: Mary's Bday",
    "body": "Due in 119 days (9/25/2025)",
    "scheduledTime": "2025-09-24T14:00:00.000Z",
    "repeat": "none",
    "createdAt": 1748541172613,
    "data": {}
  },
  {
    "id": "76afe11318bbb3c5326a8daa",
    "title": "Reminder: Karans Bday",
    "body": "Due in 15 days (6/13/2025)",
    "scheduledTime": "2025-06-12T14:00:00.000Z",
    "repeat": "none",
    "createdAt": 1748541172616,
    "data": {}
  },
  {
    "id": "e5d74fd9ba7ea6468f13ac5c",
    "title": "Reminder: Hannah Wee's Bday",
    "body": "Due in 21 days (6/19/2025)",
    "scheduledTime": "2025-06-19T14:00:00.000Z",
    "repeat": "none",
    "createdAt": 1748541172618,
    "data": {}
  },
  {
    "id": "b15bfa413184dff30f72626b",
    "title": "Reminder: Cancel your yearly microsoft 365 subscription",
    "body": "Due in 82 days (8/19/2025)",
    "scheduledTime": "2025-08-19T14:00:00.000Z",
    "repeat": "none",
    "createdAt": 1748541172621,
    "data": {}
  },
  {
    "id": "8e31912c9436936d3f349ac9",
    "title": "Reminder: Brandon Sanchez's Bday",
    "body": "Due in 21 days (6/19/2025)",
    "scheduledTime": "2025-06-19T14:00:00.000Z",
    "repeat": "none",
    "createdAt": 1748541172624,
    "data": {}
  },
  {
    "id": "34ebbdb063d34719963198af",
    "title": "Reminder: Tyler Requa's Bday",
    "body": "Due in 51 days (7/19/2025)",
    "scheduledTime": "2025-07-19T14:00:00.000Z",
    "repeat": "none",
    "createdAt": 1748541172628,
    "data": {}
  },
  {
    "id": "60aa21ddafadf993c552116a",
    "title": "Reminder: National GF Day",
    "body": "Due in 63 days (7/31/2025)",
    "scheduledTime": "2025-07-30T14:00:00.000Z",
    "repeat": "none",
    "createdAt": 1748541172631,
    "data": {}
  },
  {
    "id": "ef4a58b850f6f67b298a4aa1",
    "title": "Reminder: Brandon (Nigel) Bday",
    "body": "Due in 168 days (11/12/2025)",
    "scheduledTime": "2025-11-11T15:00:00.000Z",
    "repeat": "none",
    "createdAt": 1748541172633,
    "data": {}
  },
  {
    "id": "61e09be50b75d80e3909b282",
    "title": "Reminder: Paxton's Bday",
    "body": "Due in 173 days (11/17/2025)",
    "scheduledTime": "2025-11-16T15:00:00.000Z",
    "repeat": "none",
    "createdAt": 1748541172635,
    "data": {}
  },
  {
    "id": "f767ebb4572ae132ddc75d1f",
    "title": "Reminder: David's Bday",
    "body": "Due in 173 days (11/17/2025)",
    "scheduledTime": "2025-11-16T15:00:00.000Z",
    "repeat": "none",
    "createdAt": 1748541172638,
    "data": {}
  },
  {
    "id": "35a8dbc0f91ca85bc1f52003",
    "title": "Reminder: Kyduyen's Bday",
    "body": "Due in 182 days (11/26/2025)",
    "scheduledTime": "2025-11-25T15:00:00.000Z",
    "repeat": "none",
    "createdAt": 1748541172641,
    "data": {}
  },
  {
    "id": "3a42409136f6c971fc4c734f",
    "title": "Reminder: Kai Fernando's Bday",
    "body": "Due in 188 days (12/2/2025)",
    "scheduledTime": "2025-12-02T15:00:00.000Z",
    "repeat": "none",
    "createdAt": 1748541172644,
    "data": {}
  },
  {
    "id": "965401db894227bd8b93dd6a",
    "title": "Reminder: Cooper's Bday",
    "body": "Due in 214 days (12/28/2025)",
    "scheduledTime": "2025-12-28T15:00:00.000Z",
    "repeat": "none",
    "createdAt": 1748541172647,
    "data": {}
  },
  {
    "id": "5aea325d7b2a9b1d065fdaa4",
    "title": "Reminder: Andre Sae's Bday",
    "body": "Due in 236 days (1/19/2026)",
    "scheduledTime": "2026-01-19T15:00:00.000Z",
    "repeat": "none",
    "createdAt": 1748541172650,
    "data": {}
  },
  {
    "id": "e788965724b6906b777f6ccc",
    "title": "Reminder: Kayla's Bday",
    "body": "Due in 248 days (1/31/2026)",
    "scheduledTime": "2026-01-31T15:00:00.000Z",
    "repeat": "none",
    "createdAt": 1748541172652,
    "data": {}
  },
  {
    "id": "1dab929a5f99243afb6b5015",
    "title": "Reminder: Rafael's Bday",
    "body": "Due in 255 days (2/7/2026)",
    "scheduledTime": "2026-02-07T15:00:00.000Z",
    "repeat": "none",
    "createdAt": 1748541172655,
    "data": {}
  },
  {
    "id": "e8bdecdb195a6436955014d2",
    "title": "Reminder: Aadarsh's Bday",
    "body": "Due in 273 days (2/25/2026)",
    "scheduledTime": "2026-02-25T15:00:00.000Z",
    "repeat": "none",
    "createdAt": 1748541172658,
    "data": {}
  },
  {
    "id": "365ba10db7fa22d4a213a1d9",
    "title": "Reminder: Ethan Hoang's Bday",
    "body": "Due in 277 days (3/1/2026)",
    "scheduledTime": "2026-03-01T15:00:00.000Z",
    "repeat": "none",
    "createdAt": 1748541172661,
    "data": {}
  },
  {
    "id": "bc976245504e82e318c76009",
    "title": "Reminder: Tracie's Bday",
    "body": "Due in 309 days (4/3/2026)",
    "scheduledTime": "2026-04-03T14:00:00.000Z",
    "repeat": "none",
    "createdAt": 1748541172664,
    "data": {}
  },
  {
    "id": "d4a3c83f1ac04d6c1c79de8d",
    "title": "Reminder: Robert Herrerahs Bday",
    "body": "Due in 6 days (6/4/2025)",
    "scheduledTime": "2025-06-03T14:00:00.000Z",
    "repeat": "none",
    "createdAt": 1748541172667,
    "data": {}
  },
  {
    "id": "c9071127887e1bae9747c9e2",
    "title": "Reminder: Calina's Bday",
    "body": "Due in 123 days (9/29/2025)",
    "scheduledTime": "2025-09-28T14:00:00.000Z",
    "repeat": "none",
    "createdAt": 1748541172669,
    "data": {}
  },
  {
    "id": "c32cd9c8349c3ef1ad317ec8",
    "title": "Reminder: Update your christmas list and send it to people especially Kayla",
    "body": "Due in 197 days (12/11/2025)",
    "scheduledTime": "2025-12-11T15:00:00.000Z",
    "repeat": "none",
    "createdAt": 1748541172671,
    "data": {}
  },
  {
    "id": "5c68ce0498c54f66b5d0eacd",
    "title": "Reminder: Oscar's Bday",
    "body": "Due in 15 days (6/13/2025)",
    "scheduledTime": "2025-06-12T14:00:00.000Z",
    "repeat": "none",
    "createdAt": 1748541172674,
    "data": {}
  },
  {
    "id": "a2455e443e76cab1c5d1033b",
    "title": "Reminder: Shelly's Bday",
    "body": "Due in 160 days (11/4/2025)",
    "scheduledTime": "2025-11-03T15:00:00.000Z",
    "repeat": "none",
    "createdAt": 1748541172678,
    "data": {}
  },
  {
    "id": "c0712a56732960c7a53cdad9",
    "title": "Reminder: Neil's Bday",
    "body": "Due in 261 days (2/13/2026)",
    "scheduledTime": "2026-02-13T15:00:00.000Z",
    "repeat": "none",
    "createdAt": 1748541172681,
    "data": {}
  },
  {
    "id": "bda0ba7f56a65eb2b5f53e8e",
    "title": "Reminder: Connor Pham's Bday",
    "body": "Due in 28 days (6/26/2025)",
    "scheduledTime": "2025-06-26T14:00:00.000Z",
    "repeat": "none",
    "createdAt": 1748541475257,
    "data": {}
  },
  {
    "id": "735cd06671267b0fc06caf80",
    "title": "Reminder: Alvin Matthew's Bday",
    "body": "Due in 28 days (6/26/2025)",
    "scheduledTime": "2025-06-26T14:00:00.000Z",
    "repeat": "none",
    "createdAt": 1748541475283,
    "data": {}
  },
  {
    "id": "996028335dd55b0393bfc08b",
    "title": "Reminder: Pacey's Bday",
    "body": "Due in 58 days (7/26/2025)",
    "scheduledTime": "2025-07-26T14:00:00.000Z",
    "repeat": "none",
    "createdAt": 1748541475288,
    "data": {}
  },
  {
    "id": "149630638f68dffd37e9d82e",
    "title": "Reminder: Van's Bday",
    "body": "Due in 80 days (8/17/2025)",
    "scheduledTime": "2025-08-16T14:00:00.000Z",
    "repeat": "none",
    "createdAt": 1748541475296,
    "data": {}
  },
  {
    "id": "80326f29c4fec3acb89e461f",
    "title": "Reminder: Daniela's Bday",
    "body": "Due in 88 days (8/25/2025)",
    "scheduledTime": "2025-08-25T14:00:00.000Z",
    "repeat": "none",
    "createdAt": 1748541475300,
    "data": {}
  },
  {
    "id": "e37b6c2f464cf6983a34ea04",
    "title": "Reminder: Kevin's (me)  Bday !!!!",
    "body": "Due in 125 days (10/1/2025)",
    "scheduledTime": "2025-10-01T14:00:00.000Z",
    "repeat": "none",
    "createdAt": 1748541475303,
    "data": {}
  },
  {
    "id": "9ea5e43d999cc857b1e11a07",
    "title": "Reminder: Ben Kim's Bday",
    "body": "Due in 171 days (11/15/2025)",
    "scheduledTime": "2025-11-15T15:00:00.000Z",
    "repeat": "none",
    "createdAt": 1748541475306,
    "data": {}
  },
  {
    "id": "b45dad3baf8e80a27474d10a",
    "title": "Reminder: Jennifer's Bday",
    "body": "Due in 171 days (11/15/2025)",
    "scheduledTime": "2025-11-15T15:00:00.000Z",
    "repeat": "none",
    "createdAt": 1748541475313,
    "data": {}
  },
  {
    "id": "9ddbb5b7e443ff59906d08f7",
    "title": "Reminder: Nick le Bday",
    "body": "Due in 174 days (11/18/2025)",
    "scheduledTime": "2025-11-18T15:00:00.000Z",
    "repeat": "none",
    "createdAt": 1748541475316,
    "data": {}
  },
  {
    "id": "5569aa2e33fae2c48530cf3f",
    "title": "Reminder: Sneha's Bday",
    "body": "Due in 188 days (12/2/2025)",
    "scheduledTime": "2025-12-01T15:00:00.000Z",
    "repeat": "none",
    "createdAt": 1748541475319,
    "data": {}
  },
  {
    "id": "3be33c9e736f111ecc06af9e",
    "title": "Reminder: Ali Niaz's Bday",
    "body": "Due in 197 days (12/11/2025)",
    "scheduledTime": "2025-12-11T15:00:00.000Z",
    "repeat": "none",
    "createdAt": 1748541475323,
    "data": {}
  },
  {
    "id": "572aab9aa20a728fb97c7dca",
    "title": "Reminder: Kaden's Bday",
    "body": "Due in 200 days (12/14/2025)",
    "scheduledTime": "2025-12-14T15:00:00.000Z",
    "repeat": "none",
    "createdAt": 1748541475332,
    "data": {}
  },
  {
    "id": "e814837509c07676f07cb2ed",
    "title": "Reminder: Dan Do's Bday",
    "body": "Due in 220 days (1/3/2026)",
    "scheduledTime": "2026-01-03T15:00:00.000Z",
    "repeat": "none",
    "createdAt": 1748541475407,
    "data": {}
  },
  {
    "id": "760985aa4c165c4d8a0fae32",
    "title": "Reminder: Preston's Bday",
    "body": "Due in 221 days (1/4/2026)",
    "scheduledTime": "2026-01-04T15:00:00.000Z",
    "repeat": "none",
    "createdAt": 1748541475412,
    "data": {}
  },
  {
    "id": "3a19909963579763c6608d0c",
    "title": "Reminder: Jerin Binu's Bday",
    "body": "Due in 227 days (1/10/2026)",
    "scheduledTime": "2026-01-10T15:00:00.000Z",
    "repeat": "none",
    "createdAt": 1748541475429,
    "data": {}
  },
  {
    "id": "d3d042ea854404eb2fdbeb42",
    "title": "Reminder: Sannidhi's Bday",
    "body": "Due in 243 days (1/26/2026)",
    "scheduledTime": "2026-01-26T15:00:00.000Z",
    "repeat": "none",
    "createdAt": 1748541475453,
    "data": {}
  },
  {
    "id": "0427a0321fce13cb645f4191",
    "title": "Reminder: Jame's Bday",
    "body": "Due in 253 days (2/5/2026)",
    "scheduledTime": "2026-02-05T15:00:00.000Z",
    "repeat": "none",
    "createdAt": 1748541475456,
    "data": {}
  },
  {
    "id": "52bd02c3c85566b7a5cba4cc",
    "title": "Reminder: Bryan Nguyen's Bday",
    "body": "Due in 279 days (3/3/2026)",
    "scheduledTime": "2026-03-03T15:00:00.000Z",
    "repeat": "none",
    "createdAt": 1748541475459,
    "data": {}
  },
  {
    "id": "00b9202135f9e2a717727954",
    "title": "Reminder: Father's Day",
    "body": "Due in 16 days (6/14/2025)",
    "scheduledTime": "2025-06-13T14:00:00.000Z",
    "repeat": "none",
    "createdAt": 1748541475463,
    "data": {}
  },
  {
    "id": "d6b2fbefe58999db947629c2",
    "title": "Reminder: Lucas Chan's Bday",
    "body": "Due in 246 days (1/29/2026)",
    "scheduledTime": "2026-01-29T15:00:00.000Z",
    "repeat": "none",
    "createdAt": 1748541475466,
    "data": {}
  },
  {
    "id": "aac5fca25b1c31fdc5d1dc1c",
    "title": "Reminder: Mom's Bday",
    "body": "Due in 274 days (2/26/2026)",
    "scheduledTime": "2026-02-26T15:00:00.000Z",
    "repeat": "none",
    "createdAt": 1748541475470,
    "data": {}
  },
  {
    "id": "90e77386a002c8428b40bf98",
    "title": "Reminder: Evan's (Cousin) Bday",
    "body": "Due in 58 days (7/26/2025)",
    "scheduledTime": "2025-07-26T14:00:00.000Z",
    "repeat": "none",
    "createdAt": 1748541475473,
    "data": {}
  },
  {
    "id": "c9518f2a8f8bd630c871601b",
    "title": "Reminder: Om's Bday",
    "body": "Due in 42 days (7/10/2025)",
    "scheduledTime": "2025-07-10T14:00:00.000Z",
    "repeat": "none",
    "createdAt": 1748541475477,
    "data": {}
  },
  {
    "id": "e4aebba6d5df72491b81e43d",
    "title": "Reminder: Anthony Nguyen's Bday",
    "body": "Due in 58 days (7/26/2025)",
    "scheduledTime": "2025-07-26T14:00:00.000Z",
    "repeat": "none",
    "createdAt": 1748541475483,
    "data": {}
  },
  {
    "id": "a8b19f756f82d27da3df0153",
    "title": "Reminder: Dad's Bday",
    "body": "Due in 83 days (8/20/2025)",
    "scheduledTime": "2025-08-19T14:00:00.000Z",
    "repeat": "none",
    "createdAt": 1748541475487,
    "data": {}
  },
  {
    "id": "6d39d066a9ae4be324ea4955",
    "title": "Reminder: Jason Hammdon's Bday",
    "body": "Due in 172 days (11/16/2025)",
    "scheduledTime": "2025-11-15T15:00:00.000Z",
    "repeat": "none",
    "createdAt": 1748541475491,
    "data": {}
  },
  {
    "id": "d0dac6465f20aec5797ee4d6",
    "title": "Reminder: Cancel Isaca Membership",
    "body": "Due in 94 days (8/31/2025)",
    "scheduledTime": "2025-08-31T14:00:00.000Z",
    "repeat": "none",
    "createdAt": 1748541475500,
    "data": {}
  },
  {
    "id": "f50f287002f416e8c7fbdd25",
    "title": "Reminder: Pierson's Bday",
    "body": "Due in 178 days (11/22/2025)",
    "scheduledTime": "2025-11-22T15:00:00.000Z",
    "repeat": "none",
    "createdAt": 1748541475504,
    "data": {}
  },
  {
    "id": "2fef836e308c312218ad04b4",
    "title": "Reminder: Emiry's Bday",
    "body": "Due in 18 days (6/16/2025)",
    "scheduledTime": "2025-06-15T14:00:00.000Z",
    "repeat": "none",
    "createdAt": 1748541475506,
    "data": {}
  },
  {
    "id": "0b7ed68124102335ad9cdbee",
    "title": "Reminder: Hogan Nguyen's Bday",
    "body": "Due in 274 days (2/26/2026)",
    "scheduledTime": "2026-02-26T15:00:00.000Z",
    "repeat": "none",
    "createdAt": 1748541475510,
    "data": {}
  },
  {
    "id": "3916a108039e191b628af192",
    "title": "Reminder: Grace Ebbinghouse's Bday",
    "body": "Due in 41 days (7/9/2025)",
    "scheduledTime": "2025-07-09T14:00:00.000Z",
    "repeat": "none",
    "createdAt": 1748541475513,
    "data": {}
  },
  {
    "id": "faac818593eb2f935f5252c4",
    "title": "Reminder: Mary's Bday",
    "body": "Due in 119 days (9/25/2025)",
    "scheduledTime": "2025-09-24T14:00:00.000Z",
    "repeat": "none",
    "createdAt": 1748541475516,
    "data": {}
  },
  {
    "id": "1a1fcac15f5249f400ea390d",
    "title": "Reminder: Karans Bday",
    "body": "Due in 15 days (6/13/2025)",
    "scheduledTime": "2025-06-12T14:00:00.000Z",
    "repeat": "none",
    "createdAt": 1748541475519,
    "data": {}
  },
  {
    "id": "a58e8143f1f517c410ade6b7",
    "title": "Reminder: Hannah Wee's Bday",
    "body": "Due in 21 days (6/19/2025)",
    "scheduledTime": "2025-06-19T14:00:00.000Z",
    "repeat": "none",
    "createdAt": 1748541475522,
    "data": {}
  },
  {
    "id": "82dec8e60bae5c83f3f5a8d9",
    "title": "Reminder: Cancel your yearly microsoft 365 subscription",
    "body": "Due in 82 days (8/19/2025)",
    "scheduledTime": "2025-08-19T14:00:00.000Z",
    "repeat": "none",
    "createdAt": 1748541475527,
    "data": {}
  },
  {
    "id": "8b653a238d7c0c891235c577",
    "title": "Reminder: Brandon Sanchez's Bday",
    "body": "Due in 21 days (6/19/2025)",
    "scheduledTime": "2025-06-19T14:00:00.000Z",
    "repeat": "none",
    "createdAt": 1748541475530,
    "data": {}
  },
  {
    "id": "436dde1deb06af1dc70ec925",
    "title": "Reminder: Tyler Requa's Bday",
    "body": "Due in 51 days (7/19/2025)",
    "scheduledTime": "2025-07-19T14:00:00.000Z",
    "repeat": "none",
    "createdAt": 1748541475534,
    "data": {}
  },
  {
    "id": "2dc8d9e71d88650650209824",
    "title": "Reminder: National GF Day",
    "body": "Due in 63 days (7/31/2025)",
    "scheduledTime": "2025-07-30T14:00:00.000Z",
    "repeat": "none",
    "createdAt": 1748541475537,
    "data": {}
  },
  {
    "id": "9e29344ddffaa4b6ff73839f",
    "title": "Reminder: Brandon (Nigel) Bday",
    "body": "Due in 168 days (11/12/2025)",
    "scheduledTime": "2025-11-11T15:00:00.000Z",
    "repeat": "none",
    "createdAt": 1748541475540,
    "data": {}
  },
  {
    "id": "f3d2103c9ee54e4aca44be3a",
    "title": "Reminder: Paxton's Bday",
    "body": "Due in 173 days (11/17/2025)",
    "scheduledTime": "2025-11-16T15:00:00.000Z",
    "repeat": "none",
    "createdAt": 1748541475545,
    "data": {}
  },
  {
    "id": "ee6290f317808625672f998d",
    "title": "Reminder: David's Bday",
    "body": "Due in 173 days (11/17/2025)",
    "scheduledTime": "2025-11-16T15:00:00.000Z",
    "repeat": "none",
    "createdAt": 1748541475548,
    "data": {}
  },
  {
    "id": "a3ff74e06d5bf57b889f5e5c",
    "title": "Reminder: Kyduyen's Bday",
    "body": "Due in 182 days (11/26/2025)",
    "scheduledTime": "2025-11-25T15:00:00.000Z",
    "repeat": "none",
    "createdAt": 1748541475552,
    "data": {}
  },
  {
    "id": "7ad54f90ba98885534951e78",
    "title": "Reminder: Kai Fernando's Bday",
    "body": "Due in 188 days (12/2/2025)",
    "scheduledTime": "2025-12-02T15:00:00.000Z",
    "repeat": "none",
    "createdAt": 1748541475555,
    "data": {}
  },
  {
    "id": "9cec46eab15383f96aa90a67",
    "title": "Reminder: Cooper's Bday",
    "body": "Due in 214 days (12/28/2025)",
    "scheduledTime": "2025-12-28T15:00:00.000Z",
    "repeat": "none",
    "createdAt": 1748541475558,
    "data": {}
  },
  {
    "id": "e862cd0333d515b9b1a626f6",
    "title": "Reminder: Andre Sae's Bday",
    "body": "Due in 236 days (1/19/2026)",
    "scheduledTime": "2026-01-19T15:00:00.000Z",
    "repeat": "none",
    "createdAt": 1748541475562,
    "data": {}
  },
  {
    "id": "6452c94b1d87c5035101c319",
    "title": "Reminder: Kayla's Bday",
    "body": "Due in 248 days (1/31/2026)",
    "scheduledTime": "2026-01-31T15:00:00.000Z",
    "repeat": "none",
    "createdAt": 1748541475565,
    "data": {}
  },
  {
    "id": "34202b9a28f30a7ee5ff5a4e",
    "title": "Reminder: Rafael's Bday",
    "body": "Due in 255 days (2/7/2026)",
    "scheduledTime": "2026-02-07T15:00:00.000Z",
    "repeat": "none",
    "createdAt": 1748541475568,
    "data": {}
  },
  {
    "id": "706d8dc403e5a758c9fa6283",
    "title": "Reminder: Aadarsh's Bday",
    "body": "Due in 273 days (2/25/2026)",
    "scheduledTime": "2026-02-25T15:00:00.000Z",
    "repeat": "none",
    "createdAt": 1748541475571,
    "data": {}
  },
  {
    "id": "b195520958bcddeb6ab5a2ce",
    "title": "Reminder: Ethan Hoang's Bday",
    "body": "Due in 277 days (3/1/2026)",
    "scheduledTime": "2026-03-01T15:00:00.000Z",
    "repeat": "none",
    "createdAt": 1748541475575,
    "data": {}
  },
  {
    "id": "b771458979b8a68c5d48f286",
    "title": "Reminder: Tracie's Bday",
    "body": "Due in 309 days (4/3/2026)",
    "scheduledTime": "2026-04-03T14:00:00.000Z",
    "repeat": "none",
    "createdAt": 1748541475579,
    "data": {}
  },
  {
    "id": "356a9da8152e5dddf8630d3e",
    "title": "Reminder: Robert Herrerahs Bday",
    "body": "Due in 6 days (6/4/2025)",
    "scheduledTime": "2025-06-03T14:00:00.000Z",
    "repeat": "none",
    "createdAt": 1748541475582,
    "data": {}
  },
  {
    "id": "d1c3e262410e6031569ac6a2",
    "title": "Reminder: Calina's Bday",
    "body": "Due in 123 days (9/29/2025)",
    "scheduledTime": "2025-09-28T14:00:00.000Z",
    "repeat": "none",
    "createdAt": 1748541475586,
    "data": {}
  },
  {
    "id": "97a1ee9b467822bb2585fdf9",
    "title": "Reminder: Update your christmas list and send it to people especially Kayla",
    "body": "Due in 197 days (12/11/2025)",
    "scheduledTime": "2025-12-11T15:00:00.000Z",
    "repeat": "none",
    "createdAt": 1748541475589,
    "data": {}
  },
  {
    "id": "f3d55bcfc8c46776f90d5271",
    "title": "Reminder: Oscar's Bday",
    "body": "Due in 15 days (6/13/2025)",
    "scheduledTime": "2025-06-12T14:00:00.000Z",
    "repeat": "none",
    "createdAt": 1748541475593,
    "data": {}
  },
  {
    "id": "a138c0c18e09f8ab4d3e0ced",
    "title": "Reminder: Shelly's Bday",
    "body": "Due in 160 days (11/4/2025)",
    "scheduledTime": "2025-11-03T15:00:00.000Z",
    "repeat": "none",
    "createdAt": 1748541475596,
    "data": {}
  },
  {
    "id": "ae09c795464b7d6713e30bd3",
    "title": "Reminder: Neil's Bday",
    "body": "Due in 261 days (2/13/2026)",
    "scheduledTime": "2026-02-13T15:00:00.000Z",
    "repeat": "none",
    "createdAt": 1748541475600,
    "data": {}
  }
]